"","date","city","state","dead","injured","total","description","year","quarter","month","day","date2","weekday","lat","lng"
"1916",2021-11-17,"New York City","New York",0,4,4,"Two adults and two teens were wounded in a potentially targeted drive-by in Williamsbridge.",2021,4,"Nov",17,"Nov 17","Wed",NA,NA
"1917",2021-11-17,"Newburgh","New York",0,4,4,"Four teens were shot during a gunfight near a high school.",2021,4,"Nov",17,"Nov 17","Wed",NA,NA
"1918",2021-11-17,"Chicago","Illinois",0,4,4,"Four people were wounded in a drive-by shooting shortly after midnight on the Near West Side.",2021,4,"Nov",17,"Nov 17","Wed",41.8375,-87.6866
"1919",2021-11-15,"New York City","New York",0,4,4,"Four men were shot outside of a bodega in Harlem.",2021,4,"Nov",15,"Nov 15","Mon",NA,NA
"1920",2021-11-15,"Aurora","Colorado",0,6,6,"Six teenagers were wounded in a drive-by shooting at a park located across from a high school.",2021,4,"Nov",15,"Nov 15","Mon",39.7083,-104.7237
"1921",2021-11-14,"Philadelphia","Pennsylvania",0,6,6,"Three men and three women were shot, one man critically.",2021,4,"Nov",14,"Nov 14","Sun",40.0077,-75.1339
"1922",2021-11-14,"Columbia","Missouri",1,5,6,"Two men opened fire at each other at a lounge, wounding five. One of the shooters was killed by responding police.",2021,4,"Nov",14,"Nov 14","Sun",38.9472,-92.3268
"1923",2021-11-14,"Chiloquin","Oregon",2,2,4,"Four people were shot, two of the victims fatally.  A man from Klamath Falls was arrested and charged with murder.",2021,4,"Nov",14,"Nov 14","Sun",42.5764,-121.8677
"1924",2021-11-14,"Tucson","Arizona",4,1,5,"Four men arrived at a trailer park and confronted a homeowner and a guest, leading to the homeowner shooting and killing the four men and the guest being injured by the four attackers.",2021,4,"Nov",14,"Nov 14","Sun",32.1541,-110.8787
"1925",2021-11-14,"Troy","Alabama",1,5,6,"A man was killed and five others wounded at a gas station in the early morning.",2021,4,"Nov",14,"Nov 14","Sun",31.8021,-85.9664
"1926",2021-11-13,"Winston-Salem","North Carolina",0,4,4,"Four people were wounded after several people opened fire at a party.",2021,4,"Nov",13,"Nov 13","Sat",36.1029,-80.261
"1927",2021-11-13,"Houma","Louisiana",0,4,4,"Four people were wounded at a high school homecoming after-party, after multiple attendees began shooting.",2021,4,"Nov",13,"Nov 13","Sat",29.58,-90.7059
"1928",2021-11-12,"Richmond","Virginia",2,2,4,"Two children were killed and two adults wounded on the East End.",2021,4,"Nov",12,"Nov 12","Fri",37.5295,-77.4756
"1929",2021-11-12,"Birmingham","Alabama",2,2,4,"Two wounded were found outside a vehicle, where two were found deceased in the backseat. Several weapons were found in the vehicle.",2021,4,"Nov",12,"Nov 12","Fri",33.5279,-86.7971
"1930",2021-11-09,"Rochester","New York",0,4,4,"Four teenagers were wounded in an evening shooting.",2021,4,"Nov",9,"Nov 9","Tue",43.168,-77.6162
"1931",2021-11-09,"Scotland","South Dakota",3,2,5,"Three adults were killed and an adult and child were wounded after an argument escalated inside a home.",2021,4,"Nov",9,"Nov 9","Tue",43.1481,-97.7199
"1932",2021-11-09,"Killona","Louisiana",1,4,5,"A man was killed and three adults and a teenager wounded in an ambush-style shooting outside a grocery store.",2021,4,"Nov",9,"Nov 9","Tue",29.9985,-90.4851
"1933",2021-11-08,"Philadelphia","Pennsylvania",0,4,4,"Three teenagers and an adult were wounded after three of them exited a local store in Feltonville and were chased down the street.",2021,4,"Nov",8,"Nov 8","Mon",40.0077,-75.1339
"1934",2021-11-07,"Kenosha","Wisconsin",1,3,4,"A man was killed and three others wounded in the early morning.",2021,4,"Nov",7,"Nov 7","Sun",42.5865,-87.8773
"1935",2021-11-06,"Oakley","California",2,2,4,"Two people were killed and two wounded at a family birthday party.",2021,4,"Nov",6,"Nov 6","Sat",37.9929,-121.6952
"1936",2021-11-06,"Marshall","Texas",0,6,6,"Six people were wounded in the early morning at a large community event.",2021,4,"Nov",6,"Nov 6","Sat",32.537,-94.3515
"1937",2021-11-06,"Highland","California",0,4,4,"Shortly after midnight a man opened fire at a local bar, wounding four.",2021,4,"Nov",6,"Nov 6","Sat",34.1113,-117.165
"1938",2021-11-05,"Oakland","California",1,3,4,"A man was killed and three wounded in a drive-by shooting in East Oakland.",2021,4,"Nov",5,"Nov 5","Fri",37.7904,-122.2166
"1939",2021-11-03,"Des Moines","Iowa",0,4,4,"Four people were wounded in an evening shooting a block away from a middle school.",2021,4,"Nov",3,"Nov 3","Wed",41.5725,-93.6105
"1940",2021-11-03,"Norfolk","Virginia",3,2,5,"A man killed three women and wounded two in a targeted domestic dispute. One of the wounded was targeted and the others attempted to help her. The shooter was given four life sentences in 2024.",2021,4,"Nov",3,"Nov 3","Wed",36.8945,-76.259
"1941",2021-11-02,"Mobile","Alabama",0,4,4,"A woman shot and wounded four in a bowling alley after a fight escalated.",2021,4,"Nov",2,"Nov 2","Tue",30.6782,-88.1162
"1942",2021-11-01,"Orlando","Florida",0,4,4,"After an online dispute, a person shot four people in Downtown Orlando.",2021,4,"Nov",1,"Nov 1","Mon",28.4773,-81.337
"1943",2021-11-01,"San Antonio","Texas",0,4,4,"Four people were wounded in an evening drive-by on the West Side.",2021,4,"Nov",1,"Nov 1","Mon",29.4632,-98.5238
"1944",2021-10-31,"Flossmoor","Illinois",1,3,4,"Four people were shot just after midnight on Halloween.",2021,4,"Oct",31,"Oct 31","Sun",41.5391,-87.6858
"1945",2021-10-31,"Lakewood","Colorado",2,2,4,"Four people were shot, two fatally.",2021,4,"Oct",31,"Oct 31","Sun",39.6977,-105.1172
"1946",2021-10-31,"Houston","Texas",1,9,10,"A woman was shot and killed and nine injured at a large Halloween party of hundred people.",2021,4,"Oct",31,"Oct 31","Sun",29.786,-95.3885
"1947",2021-10-31,"Louisville","Kentucky",2,2,4,"Two cousins working as security were shot and killed. Two others were wounded.",2021,4,"Oct",31,"Oct 31","Sun",38.1663,-85.6485
"1948",2021-10-31,"Fort Worth","Texas",1,3,4,"An 18-year-old was arrested after killing a man and wounding three others in a drive-by shooting.",2021,4,"Oct",31,"Oct 31","Sun",32.7817,-97.3474
"1949",2021-10-31,"Joliet","Illinois",2,12,14,"Two people were killed and several wounded after two men opened fire on a Halloween party.",2021,4,"Oct",31,"Oct 31","Sun",41.5188,-88.1499
"1950",2021-10-30,"Gilroy","California",1,3,4,"One person was killed and three wounded after a shooting at a house party. The party occurred at the home of a Gilroy councilwoman.",2021,4,"Oct",30,"Oct 30","Sat",37.0046,-121.5854
"1951",2021-10-30,"Texarkana","Texas",1,9,10,"A man was killed and several people wounded after a shooting at a Halloween party.",2021,4,"Oct",30,"Oct 30","Sat",33.45,-94.0847
"1952",2021-10-30,"Oklahoma City","Oklahoma",0,4,4,"Four people were wounded in a residential area in the early morning.",2021,4,"Oct",30,"Oct 30","Sat",35.4676,-97.5136
"1953",2021-10-30,"Decatur","Illinois",0,4,4,"Four people were wounded at a large house party in the early morning.",2021,4,"Oct",30,"Oct 30","Sat",39.8557,-88.9342
"1954",2021-10-30,"St. Petersburg","Florida",1,4,5,"A man was killed and four others wounded at an outdoor boxing match at the Skyway Plaza.",2021,4,"Oct",30,"Oct 30","Sat",27.7931,-82.6652
"1955",2021-10-30,"Sacramento","California",2,5,7,"Two people were killed and five injured at a Halloween party that was held at a local banquet hall.",2021,4,"Oct",30,"Oct 30","Sat",38.5677,-121.4685
"1956",2021-10-29,"Kalamazoo","Michigan",0,4,4,"Four people were shot at a party inside an event center.",2021,4,"Oct",29,"Oct 29","Fri",42.2749,-85.5882
"1957",2021-10-29,"Poughkeepsie","New York",0,5,5,"Three people were wounded at a birthday party and two more were wounded as the tour bus transporting some of the wounded was later shot at.",2021,4,"Oct",29,"Oct 29","Fri",41.695,-73.9211
"1958",2021-10-28,"Sunrise Manor","Nevada",0,4,4,"Four people were wounded after an argument in an alley escalated.",2021,4,"Oct",28,"Oct 28","Thu",36.1783,-115.0487
"1959",2021-10-28,"Nashville","Tennessee",1,3,4,"A man was killed and three wounded in a suspected robbery shortly before midnight.",2021,4,"Oct",28,"Oct 28","Thu",36.1715,-86.7842
"1960",2021-10-25,"Boise","Idaho",3,4,7,"Two people, including a security guard, were shot and killed at a mall, and four others were wounded. The shooter was injured by responding officers and died the next day after being taken into custody.",2021,4,"Oct",25,"Oct 25","Mon",43.6005,-116.2308
"1961",2021-10-25,"Memphis","Tennessee",0,4,4,"Three teenagers and an adult were wounded after a shooting near an elementary school.",2021,4,"Oct",25,"Oct 25","Mon",35.1087,-89.9663
"1962",2021-10-24,"Gonzales","California",2,2,4,"Two people were killed, and two others injured at an off-roading event.",2021,4,"Oct",24,"Oct 24","Sun",36.5055,-121.4427
"1963",2021-10-24,"Crenshaw","Mississippi",2,3,5,"Two people were killed and three injured in a shooting on Jones Street.",2021,4,"Oct",24,"Oct 24","Sun",34.5047,-90.1946
"1964",2021-10-23,"Florence","South Carolina",0,6,6,"Six people were wounded in an early morning shooting at a local bar.",2021,4,"Oct",23,"Oct 23","Sat",34.178,-79.7898
"1965",2021-10-23,"Ontario","California",1,4,5,"A teenager was killed and one adult and three juveniles wounded at a Halloween party.",2021,4,"Oct",23,"Oct 23","Sat",34.0393,-117.6064
"1966",2021-10-23,"Fort Valley","Georgia",1,7,8,"A man was killed and seven others wounded at an off-campus party about two blocks from Fort Valley State University.",2021,4,"Oct",23,"Oct 23","Sat",32.552,-83.8817
"1967",2021-10-22,"Chicago","Illinois",0,5,5,"Five people were wounded outside a Chatham liqueur store when a man opened fire and then fled.",2021,4,"Oct",22,"Oct 22","Fri",41.8375,-87.6866
"1968",2021-10-22,"Renton","Washington",0,4,4,"Four people were wounded in the parking lot of a banquet hall that was hosting a Halloween party.",2021,4,"Oct",22,"Oct 22","Fri",47.4784,-122.1918
"1969",2021-10-22,"Baltimore","Maryland",0,7,7,"Five adults and two teenagers were wounded in a drive-by shooting.",2021,4,"Oct",22,"Oct 22","Fri",39.3051,-76.6144
"1970",2021-10-21,"Tacoma","Washington",4,0,4,"Three adults were killed and a fourth later died at the hospital in a night time shooting.",2021,4,"Oct",21,"Oct 21","Thu",47.2431,-122.4531
"1971",2021-10-21,"New York City","New York",0,4,4,"A gunman exited a subway station and shot four people in the Flatbush section of Brooklyn.",2021,4,"Oct",21,"Oct 21","Thu",NA,NA
"1972",2021-10-20,"Farwell","Michigan",4,0,4,"A woman shot and killed her father, sister and two workers at their home in the afternoon. The shooter was given life without parole in 2022.",2021,4,"Oct",20,"Oct 20","Wed",43.8363,-84.8677
"1973",2021-10-19,"Kenosha","Wisconsin",3,2,5,"A man killed his roommate's teenage daughter and her boyfriend, and wounded his roommate and her 14-year-old son. He later killed himself.",2021,4,"Oct",19,"Oct 19","Tue",42.5865,-87.8773
"1974",2021-10-17,"Houston","Texas",0,5,5,"Responding officers found an SUV in a ditch with bullet holes and blood near Winzer Park. Four adults and a juvenile were later identified at local hospitals although none had reached out to police.",2021,4,"Oct",17,"Oct 17","Sun",29.786,-95.3885
"1975",2021-10-17,"St. Louis","Missouri",1,3,4,"A 19-year-old was killed and three teenagers were wounded in the early morning in the Baden neighborhood.",2021,4,"Oct",17,"Oct 17","Sun",38.6359,-90.2451
"1976",2021-10-17,"Pine Bluff","Arkansas",1,3,4,"Responding officers found four people wounded and shell casings around a car in the intersection.",2021,4,"Oct",17,"Oct 17","Sun",34.2116,-92.0173
"1977",2021-10-17,"Colorado Springs","Colorado",0,5,5,"Five people were wounded outside a local bar after an unknown number of people opened fire.",2021,4,"Oct",17,"Oct 17","Sun",38.8674,-104.7605
"1978",2021-10-17,"Grambling","Louisiana",1,7,8,"A person was killed and seven others wounded at Grambling State University during a homecoming event in the early morning.",2021,4,"Oct",17,"Oct 17","Sun",32.5275,-92.7124
"1979",2021-10-17,"Racine","Wisconsin",0,6,6,"Six people were wounded at a one-year anniversary vigil for a man killed in the location. Neighbors refused to cooperate with police due to fear of retaliation.",2021,4,"Oct",17,"Oct 17","Sun",42.7274,-87.8135
"1980",2021-10-17,"Pine Bluff","Arkansas",1,7,8,"Gunfire erupted at a party hall wounding eleven and killing one, responding police opened fire on a man holding a gun and wounded him.",2021,4,"Oct",17,"Oct 17","Sun",34.2116,-92.0173
"1981",2021-10-17,"Jackson","Mississippi",3,3,6,"Three people were killed and three injured after a man opened fire inside a night club.",2021,4,"Oct",17,"Oct 17","Sun",32.3157,-90.2125
"1982",2021-10-16,"Killeen","Texas",1,3,4,"Four people were wounded in the parking lot of a club in the early morning. One of the wounded died two days later.",2021,4,"Oct",16,"Oct 16","Sat",31.0753,-97.7297
"1983",2021-10-15,"Mobile","Alabama",0,5,5,"Five people were wounded at a high school football game.",2021,4,"Oct",15,"Oct 15","Fri",30.6782,-88.1162
"1984",2021-10-14,"Minneapolis","Minnesota",1,4,5,"Responding police found five people wounded in Ventura Village. One of the wounded later died at the hospital.",2021,4,"Oct",14,"Oct 14","Thu",44.9635,-93.2678
"1985",2021-10-12,"Naples","Florida",1,5,6,"A man was killed and three others wounded after two shooters opened fire on a Naples Park home. The shooters were also wounded.",2021,4,"Oct",12,"Oct 12","Tue",26.1504,-81.7936
"1986",2021-10-12,"Meridian","Mississippi",3,1,4,"Three adults were killed in a home and an infant was found wounded.",2021,4,"Oct",12,"Oct 12","Tue",32.3846,-88.6896
"1987",2021-10-11,"South Fulton","Georgia",0,6,6,"Three wounded were found by responding officers, a fourth flagged down officers and two others were found at local hospitals.",2021,4,"Oct",11,"Oct 11","Mon",33.6273,-84.58
"1988",2021-10-10,"McColl","South Carolina",2,3,5,"Two people were killed and three injured in a shooting near a nightclub.",2021,4,"Oct",10,"Oct 10","Sun",34.6665,-79.5447
"1989",2021-10-10,"Saint Paul","Minnesota",1,14,15,"One person was killed and 14 injured in a shootout at a bar.",2021,4,"Oct",10,"Oct 10","Sun",NA,NA
"1990",2021-10-10,"Sioux City","Iowa",0,4,4,"Four bystanders were wounded at an after hours club  in an early morning targeted shooting.",2021,4,"Oct",10,"Oct 10","Sun",42.4959,-96.3901
"1991",2021-10-10,"Chicago","Illinois",1,4,5,"A man was killed and four others injured in an early morning drive-by outside a Wicker Park nightclub.",2021,4,"Oct",10,"Oct 10","Sun",41.8375,-87.6866
"1992",2021-10-10,"Dover","Delaware",1,4,5,"A man was killed and four others wounded after a drive-by shooting at a house party in the early morning.",2021,4,"Oct",10,"Oct 10","Sun",39.161,-75.5202
"1993",2021-10-09,"Dallas","Texas",0,4,4,"Three 18-year-olds and a 16-year-old were wounded in South Dallas.",2021,4,"Oct",9,"Oct 9","Sat",32.7935,-96.7667
"1994",2021-10-09,"Albany","New York",1,6,7,"Responding officers found one man deceased and six wounded were later found in local hospitals.",2021,4,"Oct",9,"Oct 9","Sat",42.6664,-73.7987
"1995",2021-10-09,"Denver","Colorado",1,3,4,"Responding officers found one man killed and three wounded.",2021,4,"Oct",9,"Oct 9","Sat",39.762,-104.8758
"1996",2021-10-09,"Livingston","Louisiana",2,4,6,"Two people were killed and three others wounded after a man went on a multi-parish shooting spree. He was later arrested with a self-inflicted gunshot wound and a dog bite.",2021,4,"Oct",9,"Oct 9","Sat",30.4953,-90.7467
"1997",2021-10-08,"Baltimore","Maryland",0,4,4,"Four men were wounded in Southeast Baltimore in the afternoon.",2021,4,"Oct",8,"Oct 8","Fri",39.3051,-76.6144
"1998",2021-10-08,"Washington","District of Columbia",1,3,4,"Responding police discovered a deceased man and another wounded, with two more identified at local hospitals.",2021,4,"Oct",8,"Oct 8","Fri",38.9047,-77.0163
"1999",2021-10-07,"Milwaukee","Wisconsin",3,1,4,"Three adults were killed and another wounded after two men came back thirty minutes after an argument over parking and opened fire.",2021,4,"Oct",7,"Oct 7","Thu",43.0642,-87.9675
"2000",2021-10-07,"Chicago","Illinois",0,4,4,"Two teenagers and two adults were wounded in the early morning after someone opened fire on another car on the Near North Side.",2021,4,"Oct",7,"Oct 7","Thu",41.8375,-87.6866
"2001",2021-10-07,"Milwaukee","Wisconsin",0,5,5,"Five people were wounded when a police officer opened fire on an armed suspect who returned fire before he fled the area.",2021,4,"Oct",7,"Oct 7","Thu",43.0642,-87.9675
"2002",2021-10-06,"Baltimore","Maryland",1,5,6,"A woman was killed and five people were wounded in East Baltimore.",2021,4,"Oct",6,"Oct 6","Wed",39.3051,-76.6144
"2003",2021-10-06,"Cleveland","Ohio",0,4,4,"Four adults were wounded at a music studio shortly before midnight.",2021,4,"Oct",6,"Oct 6","Wed",41.4764,-81.6805
"2004",2021-10-06,"New Orleans","Louisiana",2,2,4,"Two men were killed and two others wounded after four people exited a vehicle and opened fire on them. The victims were doing work in a parking lot behind a church.",2021,4,"Oct",6,"Oct 6","Wed",30.0687,-89.9288
"2005",2021-10-05,"Rockford","Illinois",1,3,4,"Responding police found four injured due to an evening shooting and one later died at the hospital.",2021,4,"Oct",5,"Oct 5","Tue",42.2596,-89.064
"2006",2021-10-05,"Saint Paul","Minnesota",0,4,4,"A teen shot four people inside a vehicle at an intersection.",2021,4,"Oct",5,"Oct 5","Tue",NA,NA
"2007",2021-10-04,"Minneapolis","Minnesota",0,4,4,"Three men and a juvenile were wounded at a local gas station.",2021,4,"Oct",4,"Oct 4","Mon",44.9635,-93.2678
"2008",2021-10-03,"Bishopville","South Carolina",1,4,5,"A man was killed and four others wounded in an early morning drive by shooting at a Waffle House.",2021,4,"Oct",3,"Oct 3","Sun",34.2202,-80.2483
"2009",2021-10-02,"Aurora","Colorado",1,3,4,"A man was killed and two adults and a teenager were wounded at an early morning hotel party,",2021,4,"Oct",2,"Oct 2","Sat",39.7083,-104.7237
"2010",2021-10-02,"San Antonio","Texas",1,3,4,"A man was killed and two adults and a teenager wounded at an apartment complex.",2021,4,"Oct",2,"Oct 2","Sat",29.4632,-98.5238
"2011",2021-10-01,"Washington","District of Columbia",1,5,6,"Five adults were wounded and one killed in Southwest D.C. late at night.",2021,4,"Oct",1,"Oct 1","Fri",38.9047,-77.0163
"2012",2021-10-01,"Cedar Rapids","Iowa",0,6,6,"Five adults and a teenager were wounded after an argument at a hotel birthday party celebration escalated.",2021,4,"Oct",1,"Oct 1","Fri",41.9662,-91.6783
"2013",2021-09-29,"Chicago","Illinois",0,5,5,"Four bystanders and a suspect were wounded when passengers of two separate cars opened fire on one another while driving down a Fulton River District road.",2021,3,"Sep",29,"Sep 29","Wed",41.8375,-87.6866
"2014",2021-09-28,"Chicago","Illinois",1,3,4,"A woman was killed and three others injured in the early morning after a man opened fire on a car in Park Manor.",2021,3,"Sep",28,"Sep 28","Tue",41.8375,-87.6866
"2015",2021-09-28,"Minneapolis","Minnesota",1,3,4,"A man was fatally shot and three others injured in a gunfire incident on Bloomington Avenue in the Phillips neighborhood.",2021,3,"Sep",28,"Sep 28","Tue",44.9635,-93.2678
"2016",2021-09-27,"Chicago","Illinois",1,3,4,"A man was killed and two adults and a teenager wounded in Humboldt Park on the Northwest Side.",2021,3,"Sep",27,"Sep 27","Mon",41.8375,-87.6866
"2017",2021-09-27,"New York City","New York",0,5,5,"A man opened fire outside a club in Inwood in Upper Manhattan wounding four. Responding officers opened fire and wounded him.",2021,3,"Sep",27,"Sep 27","Mon",NA,NA
"2018",2021-09-26,"Des Moines","Washington",3,3,6,"Two groups of people began fighting in a bar and others joined in as it spilled into the parking lot. Some fighters got into cars and opened fire while driving away killing three and wounding three others.",2021,3,"Sep",26,"Sep 26","Sun",47.3914,-122.3156
"2019",2021-09-26,"Chicago","Illinois",0,6,6,"Six adults were wounded in East Garfield Park on the West Side in the early morning.",2021,3,"Sep",26,"Sep 26","Sun",41.8375,-87.6866
"2020",2021-09-26,"Oakland","California",0,4,4,"Four people including a teenager were wounded in East Oakland.",2021,3,"Sep",26,"Sep 26","Sun",37.7904,-122.2166
"2021",2021-09-25,"Utica","New York",0,4,4,"Four men were wounded in the early morning.",2021,3,"Sep",25,"Sep 25","Sat",43.0962,-75.2261
"2022",2021-09-25,"Chattanooga","Tennessee",2,5,7,"Responding police found two adults killed and four adults and a child wounded.",2021,3,"Sep",25,"Sep 25","Sat",35.066,-85.2481
"2023",2021-09-25,"Riverside","California",0,6,6,"Shortly after midnight six people were wounded at a large house party.",2021,3,"Sep",25,"Sep 25","Sat",33.9381,-117.3949
"2024",2021-09-25,"Athens","Tennessee",4,0,4,"Two adults arrived at a home and engaged in an argument with the four adults there over a 10-month old. The dispute escalated and the four adults living at the home were killed and the two suspects kidnapped the child. One of the perpetrators was given four life sentences in 2024.",2021,3,"Sep",25,"Sep 25","Sat",35.4573,-84.6045
"2025",2021-09-24,"Aiken","South Carolina",4,1,5,"A man murdered his parents and sister and wounded another sibling before committing suicide.",2021,3,"Sep",24,"Sep 24","Fri",33.5303,-81.7271
"2026",2021-09-24,"Los Angeles","California",0,4,4,"Four people were wounded at the Rosa Parks Metro Station in Willowbrook.",2021,3,"Sep",24,"Sep 24","Fri",34.1141,-118.4068
"2027",2021-09-23,"Collierville","Tennessee",2,14,16,"Collierville Kroger shooting: A worker at a third-party venue inside the store opened fire in a Kroger, killing one and injuring 14, before taking his own life.",2021,3,"Sep",23,"Sep 23","Thu",35.047,-89.6987
"2028",2021-09-23,"Philadelphia","Pennsylvania",0,4,4,"Four men were wounded in the Mantua neighborhood.",2021,3,"Sep",23,"Sep 23","Thu",40.0077,-75.1339
"2029",2021-09-22,"Fayetteville","North Carolina",2,2,4,"Two teenagers were killed and two others injured in a home invasion. Three days earlier a relative of the two deceased had been killed in another home.",2021,3,"Sep",22,"Sep 22","Wed",35.085,-78.9772
"2030",2021-09-21,"Washington","District of Columbia",0,5,5,"A man opened fire and wounded four adults and one child near Alabama Avenue, Southeast.",2021,3,"Sep",21,"Sep 21","Tue",38.9047,-77.0163
"2031",2021-09-20,"El Monte","California",1,4,5,"A man was killed and four others wounded, with the deceased found behind the wheel of a vehicle.",2021,3,"Sep",20,"Sep 20","Mon",34.0739,-118.0291
"2032",2021-09-20,"Philadelphia","Pennsylvania",1,5,6,"A man was killed and five others injured in a drive-by shooting in the Fern Rock neighborhood.",2021,3,"Sep",20,"Sep 20","Mon",40.0077,-75.1339
"2033",2021-09-20,"St. Louis","Missouri",1,3,4,"A man was killed and three others wounded while at a vigil for another homicide victim, when a group of people opened fire from a black SUV.",2021,3,"Sep",20,"Sep 20","Mon",38.6359,-90.2451
"2034",2021-09-19,"Yemassee","South Carolina",1,7,7,"After an argument escalated someone opened fire shortly after midnight killing one adult and wounding one adult and seven children.",2021,3,"Sep",19,"Sep 19","Sun",32.6733,-80.8515
"2035",2021-09-19,"Miami","Florida",0,4,4,"During an argument one of the victims pulled out her gun and pointed it at the ground, after things calmed down she put it away and began to enter a car with her husband, and two children. The man she was arguing with opened fire once they got to the car, wounding her, her husband and two children.",2021,3,"Sep",19,"Sep 19","Sun",25.784,-80.2101
"2036",2021-09-19,"Dallas","Texas",2,4,6,"Two adults were killed and three others and a teenager wounded shortly after midnight when a man opened fire.",2021,3,"Sep",19,"Sep 19","Sun",32.7935,-96.7667
"2037",2021-09-19,"Oakland","California",1,3,4,"A man was killed and three others wounded in the early morning while outside a club.",2021,3,"Sep",19,"Sep 19","Sun",37.7904,-122.2166
"2038",2021-09-19,"Chicago","Illinois",0,5,5,"Five people were wounded while sitting on a porch in Austin during the early morning, after two men exited a vehicle and opened fire.",2021,3,"Sep",19,"Sep 19","Sun",41.8375,-87.6866
"2039",2021-09-19,"Rochester","New York",2,2,4,"Two people were killed and two injured after someone shot down an alley at a group standing outside, who were attending a party. The shooting occurred on the anniversary of a similar mass shooting in 2020.",2021,3,"Sep",19,"Sep 19","Sun",43.168,-77.6162
"2040",2021-09-18,"New York City","New York",1,3,4,"A man was killed and three others wounded at a BBQ at Claremont Park in the Bronx, after an argument escalated.",2021,3,"Sep",18,"Sep 18","Sat",NA,NA
"2041",2021-09-18,"Danville","Illinois",2,2,4,"Two people were killed and two wounded at a liquor store in the early morning.",2021,3,"Sep",18,"Sep 18","Sat",40.1426,-87.6111
"2042",2021-09-18,"New York City","New York",0,4,4,"Four people were shot outside a club in the East Flatbush area of Brooklyn after a dispute.",2021,3,"Sep",18,"Sep 18","Sat",NA,NA
"2043",2021-09-18,"Opelousas","Louisiana",0,5,5,"Five family members were injured after a gunman opened fire on their mobile home at night.",2021,3,"Sep",18,"Sep 18","Sat",30.5252,-92.0816
"2044",2021-09-17,"Augusta","Georgia",0,4,4,"Four people were wounded in the early morning at a night club. Two men were later arrested.",2021,3,"Sep",17,"Sep 17","Fri",33.3645,-82.0708
"2045",2021-09-14,"Baltimore","Maryland",0,4,4,"Three teenagers and a boy were injured in a shooting.",2021,3,"Sep",14,"Sep 14","Tue",39.3051,-76.6144
"2046",2021-09-14,"Cleveland","Ohio",0,6,6,"Six people were wounded after an incident at a liquor store escalated.",2021,3,"Sep",14,"Sep 14","Tue",41.4764,-81.6805
