"","date","city","state","dead","injured","total","description","year","quarter","month","day","date2","weekday","lat","lng"
"957",2023-04-23,"Jasper County","Texas",0,11,11,"Eleven were injured at an after-prom party north of Jasper. Four juveniles from the neighboring town of Newton were arrested in connection with the incident, with two of them being found 35 miles  away in DeRidder, Louisiana. Police say that more arrests were expected to come.",2023,2,"Apr",23,"Apr 23","Sun",NA,NA
"958",2023-04-22,"Winston-Salem","North Carolina",1,4,5,"One woman was killed and four people injured at a large outdoor party.",2023,2,"Apr",22,"Apr 22","Sat",36.1029,-80.261
"959",2023-04-21,"Washington","District of Columbia",0,8,8,"In Southeast DC, police found seven men injured, and later found a girl injured in the same neighborhood, which they said may be related.",2023,2,"Apr",21,"Apr 21","Fri",38.9047,-77.0163
"960",2023-04-21,"Rockmart","Georgia",0,4,4,"Four people were injured at an intersection.",2023,2,"Apr",21,"Apr 21","Fri",34.0103,-85.044
"961",2023-04-20,"Hartford","Connecticut",1,3,4,"Three people were injured in a drive-by shooting, and a 12-year-old girl was killed.",2023,2,"Apr",20,"Apr 20","Thu",41.7661,-72.6834
"962",2023-04-18,"Bowdoin and Yarmouth","Maine",4,3,7,"2023 Bowdoin–Yarmouth shootings: After four people were killed in a home in Bowdoin, shots were fired at vehicles along Interstate 295 in Yarmouth, wounding three people. A suspect was taken into custody.",2023,2,"Apr",18,"Apr 18","Tue",NA,NA
"963",2023-04-17,"Baltimore","Maryland",0,4,4,"Four people were injured in a shootout on Charles Street.",2023,2,"Apr",17,"Apr 17","Mon",39.3051,-76.6144
"964",2023-04-17,"Houston","Texas",1,3,4,"A man was injured in a dispute in with another man at a bus stop, as well as a bystander. Another person then exited a nearby restaurant before killing the first suspect, accidentally hitting a rideshare driver.",2023,2,"Apr",17,"Apr 17","Mon",29.786,-95.3885
"965",2023-04-16,"Maili","Hawaii",2,3,5,"A man and woman were killed and three others injured at an illegal cockfight. Two people were arrested.",2023,2,"Apr",16,"Apr 16","Sun",21.4133,-158.1701
"966",2023-04-16,"Biloxi","Mississippi",0,5,5,"Five people were injured, one a police officer, near a Surf Style store on U.S. 90.",2023,2,"Apr",16,"Apr 16","Sun",30.4426,-88.9514
"967",2023-04-15,"Dadeville","Alabama",4,32,36,"2023 Dadeville shooting: Four were killed and thirty-two were injured at a 16th birthday party at the Mahogany Masterpiece Dance Studio after an argument escalated.",2023,2,"Apr",15,"Apr 15","Sat",32.8326,-85.7675
"968",2023-04-15,"Louisville","Kentucky",2,4,6,"Two people were killed and four were injured at Chickasaw Park.",2023,2,"Apr",15,"Apr 15","Sat",38.1663,-85.6485
"969",2023-04-15,"Los Angeles","California",1,3,4,"One man was killed and three men were injured outside an ice cream shop in the Northridge neighborhood.",2023,2,"Apr",15,"Apr 15","Sat",34.1141,-118.4068
"970",2023-04-15,"Detroit","Michigan",1,3,4,"One person was killed and three injured in Downtown Detroit.",2023,2,"Apr",15,"Apr 15","Sat",42.3834,-83.1024
"971",2023-04-14,"Kansas City","Missouri",1,4,5,"One person was killed and four injured at a gas station.",2023,2,"Apr",14,"Apr 14","Fri",39.1238,-94.5541
"972",2023-04-13,"New York City","New York",0,4,4,"Three women and a 28-year-old man were injured outside a restaurant in Soundview, Bronx.",2023,2,"Apr",13,"Apr 13","Thu",NA,NA
"973",2023-04-13,"Houston","Texas",0,4,4,"Four people were injured in Southeast Houston in an attempted robbery at a gas station.",2023,2,"Apr",13,"Apr 13","Thu",29.786,-95.3885
"974",2023-04-13,"Detroit","Michigan",0,5,5,"Five people were injured, including two teenagers and at least one of the suspected shooters, on the west side following a shootout. According to police the shootout occurred after a pizza was delivered to the wrong house, which the occupants ate. Police said the people who ordered the pizza confronted those who ate it, leading to the shooting.",2023,2,"Apr",13,"Apr 13","Thu",42.3834,-83.1024
"975",2023-04-13,"Bridgeport","Connecticut",0,4,4,"Four people were injured at Seaside Park. Three people were arrested.",2023,2,"Apr",13,"Apr 13","Thu",41.1918,-73.1954
"976",2023-04-12,"Toledo","Ohio",0,6,6,"Six people were injured at a large gathering at Smith Park.",2023,2,"Apr",12,"Apr 12","Wed",41.6638,-83.5827
"977",2023-04-12,"Fort Wayne","Indiana",1,3,4,"One man was killed and three men were injured outside an apartment complex.",2023,2,"Apr",12,"Apr 12","Wed",41.0888,-85.1436
"978",2023-04-12,"Goldsboro","North Carolina",1,5,6,"One teenage girl was killed and five other teenagers were injured near a Piggly Wiggly store.",2023,2,"Apr",12,"Apr 12","Wed",35.3778,-77.9717
"979",2023-04-12,"Trenton","New Jersey",0,4,4,"Four people were injured in a drive-by at an intersection.",2023,2,"Apr",12,"Apr 12","Wed",40.2237,-74.7641
"980",2023-04-11,"Washington","District of Columbia",1,3,4,"One person was killed and three injured at a funeral home in Northeast DC.",2023,2,"Apr",11,"Apr 11","Tue",38.9047,-77.0163
"981",2023-04-10,"Louisville","Kentucky",6,8,14,"2023 Louisville shooting: Five people were killed and eight injured at an Old National Bank branch in Downtown Louisville. The suspect, a former employee at the bank who had recently been terminated, was killed by police.",2023,2,"Apr",10,"Apr 10","Mon",38.1663,-85.6485
"982",2023-04-10,"Guayama","Puerto Rico",3,2,5,"Three people were killed and two wounded at a corner store.",2023,2,"Apr",10,"Apr 10","Mon",17.9743,-66.1104
"983",2023-04-09,"Orlando","Florida",3,2,5,"Three people were killed and two wounded after a shooting during an Easter egg hunt at a park.",2023,2,"Apr",9,"Apr 9","Sun",28.4773,-81.337
"984",2023-04-08,"Houston","Texas",0,4,4,"Four people injured in the parking lot of The Selena apartment complex in Eastern Harris County.",2023,2,"Apr",8,"Apr 8","Sat",29.786,-95.3885
"985",2023-04-07,"Isle of Palms","South Carolina",0,6,6,"Six people, including teens and adults, were injured on a beach near a condo.",2023,2,"Apr",7,"Apr 7","Fri",32.8043,-79.7552
"986",2023-04-07,"New Orleans","Louisiana",0,4,4,"Two women and two children were injured on Interstate 10. The boy was critically wounded.",2023,2,"Apr",7,"Apr 7","Fri",30.0687,-89.9288
"987",2023-04-07,"Park Forest","Illinois",1,3,4,"One person killed at the scene, and three others injured, at a family gathering.",2023,2,"Apr",7,"Apr 7","Fri",41.4817,-87.6867
"988",2023-04-06,"Philadelphia","Pennsylvania",0,4,4,"A woman was placed in critical condition and three others were injured in the Nicetown–Tioga neighborhood of North Philadelphia.",2023,2,"Apr",6,"Apr 6","Thu",40.0077,-75.1339
"989",2023-04-05,"Virginia Beach","Virginia",0,4,4,"Four people were injured.",2023,2,"Apr",5,"Apr 5","Wed",36.7335,-76.0435
"990",2023-04-05,"Kansas City","Kansas",0,6,6,"Three police officers and three suspects were injured during a shootout after an undercover fentanyl investigation.",2023,2,"Apr",5,"Apr 5","Wed",39.1235,-94.7443
"991",2023-04-04,"Philadelphia","Pennsylvania",1,4,5,"A man was killed and four others injured in the Kensington neighborhood.",2023,2,"Apr",4,"Apr 4","Tue",40.0077,-75.1339
"992",2023-04-03,"Jackson","Tennessee",0,4,4,"Police found five people in a car, four of them injured.",2023,2,"Apr",3,"Apr 3","Mon",35.6538,-88.8354
"993",2023-04-03,"Atlanta","Georgia",1,3,4,"A man died at the Grady Hospital and three others injured at the Flipper Temple Apartments complex near the Westside Atlanta Charter School.",2023,2,"Apr",3,"Apr 3","Mon",33.7628,-84.422
"994",2023-04-03,"Pueblo","Colorado",1,3,4,"A teenager was killed and three women were injured.",2023,2,"Apr",3,"Apr 3","Mon",38.2701,-104.6114
"995",2023-04-02,"Fayetteville","North Carolina",1,4,5,"Four men were injured and one killed at the EV Lounge hookah bar in a shopping center.",2023,2,"Apr",2,"Apr 2","Sun",35.085,-78.9772
"996",2023-04-02,"Washington","District of Columbia",0,4,4,"Four men were injured on Martin Luther King Jr. Avenue in Southeast DC.",2023,2,"Apr",2,"Apr 2","Sun",38.9047,-77.0163
"997",2023-04-02,"Moreno Valley","California",0,4,4,"Two men and two boys were injured.",2023,2,"Apr",2,"Apr 2","Sun",33.9244,-117.2045
"998",2023-04-01,"Oklahoma City","Oklahoma",3,3,6,"Three people were killed and three others injured at a bar in southwest Oklahoma City following a shootout between biker gangs.",2023,2,"Apr",1,"Apr 1","Sat",35.4676,-97.5136
"999",2023-04-01,"Los Angeles","California",1,3,4,"One person was killed and three injured in a Trader Joe's parking lot in West Hills.",2023,2,"Apr",1,"Apr 1","Sat",34.1141,-118.4068
"1000",2023-04-01,"Baltimore","Maryland",3,1,4,"Three were killed and one injured in Northeast Baltimore.",2023,2,"Apr",1,"Apr 1","Sat",39.3051,-76.6144
"1001",2023-03-29,"Memphis","Tennessee",2,5,7,"Two people were killed and five were injured outside a Hickory Hill restaurant. One man was found dead at the scene and the other died at a hospital.",2023,1,"Mar",29,"Mar 29","Wed",35.1087,-89.9663
"1002",2023-03-27,"Nashville","Tennessee",7,1,8,"2023 Nashville school shooting: Six people were killed, including three children, and one injured at Covenant School in the Green Hills neighborhood. The perpetrator, a 28-year-old ex-student, was also killed a short time later.",2023,1,"Mar",27,"Mar 27","Mon",36.1715,-86.7842
"1003",2023-03-27,"Milwaukee","Wisconsin",0,5,5,"Five people were injured outside the Prime Social restaurant and bar.",2023,1,"Mar",27,"Mar 27","Mon",43.0642,-87.9675
"1004",2023-03-26,"Philadelphia","Pennsylvania",2,2,4,"Two were killed and two others injured in North Philadelphia.",2023,1,"Mar",26,"Mar 26","Sun",40.0077,-75.1339
"1005",2023-03-26,"Little Rock","Arkansas",2,5,7,"Two people died and five more were wounded and hospitalized.",2023,1,"Mar",26,"Mar 26","Sun",34.7256,-92.3577
"1006",2023-03-26,"Hempstead","New York",0,4,4,"Four men were injured near a child's birthday party.",2023,1,"Mar",26,"Mar 26","Sun",NA,NA
"1007",2023-03-26,"Minden","Louisiana",0,4,4,"Four shot during a family event at Ewell Park Recreation Center.",2023,1,"Mar",26,"Mar 26","Sun",32.6187,-93.2762
"1008",2023-03-26,"Brooklyn Center","Minnesota",0,6,6,"Six people, all of whom were under the age of 18, sustained non-life-threatening injuries after more than 50 gunshot rounds were fired in the parking lot of a Girl Scouts headquarters building.",2023,1,"Mar",26,"Mar 26","Sun",45.0681,-93.3162
"1009",2023-03-25,"Williamston","North Carolina",0,5,5,"Five people were shot during a party in a public housing development.",2023,1,"Mar",25,"Mar 25","Sat",35.8465,-77.0661
"1010",2023-03-25,"Shreveport","Louisiana",1,5,6,"One was killed and five were injured when multiple people got out of an SUV and randomly shot at pedestrians.",2023,1,"Mar",25,"Mar 25","Sat",32.4653,-93.7955
"1011",2023-03-23,"Baltimore","Maryland",1,5,6,"One man was killed and five other people were injured including a teenager, in West Baltimore.",2023,1,"Mar",23,"Mar 23","Thu",39.3051,-76.6144
"1012",2023-03-21,"Trenton","New Jersey",0,4,4,"Four people were injured in a drive-by shooting, including a 15-year-old boy.",2023,1,"Mar",21,"Mar 21","Tue",40.2237,-74.7641
"1013",2023-03-21,"Sumter","South Carolina",5,0,5,"A perpetrator killed three children and an adult at a home before killing himself.",2023,1,"Mar",21,"Mar 21","Tue",33.9392,-80.393
"1014",2023-03-20,"Milwaukee","Wisconsin",1,5,6,"A teenage boy was killed and five women were injured.",2023,1,"Mar",20,"Mar 20","Mon",43.0642,-87.9675
"1015",2023-03-18,"Columbus","Ohio",2,4,6,"Two people were killed and four others injured inside Tha Plug nightclub.",2023,1,"Mar",18,"Mar 18","Sat",39.9862,-82.9855
"1016",2023-03-18,"Chicago","Illinois",0,4,4,"Three men opened fire into a restaurant and injured three men and a woman in South Shore.",2023,1,"Mar",18,"Mar 18","Sat",41.8375,-87.6866
"1017",2023-03-18,"Dallas","Texas",0,4,4,"Four people were hospitalized from a shooting at an intersection.",2023,1,"Mar",18,"Mar 18","Sat",32.7935,-96.7667
"1018",2023-03-15,"Modesto","California",2,2,4,"Two men were killed and two others injured in a residential shooting.",2023,1,"Mar",15,"Mar 15","Wed",37.6375,-121.0028
"1019",2023-03-14,"Birmingham  and St. Clair County","Alabama",4,0,4,"A man killed two people in Birmingham, before killing a man and woman inside a home in St. Clair County. The suspect surrendered, alerted police and confessed to killing the four people.",2023,1,"Mar",14,"Mar 14","Tue",NA,NA
"1020",2023-03-13,"Lubbock","Texas",0,4,4,"Four people were injured in south Lubbock.",2023,1,"Mar",13,"Mar 13","Mon",33.5657,-101.8879
"1021",2023-03-12,"Dallas","Texas",4,0,4,"Two men and two women were killed in an apartment complex in Northwest Dallas. Two suspects were taken into custody.",2023,1,"Mar",12,"Mar 12","Sun",32.7935,-96.7667
"1022",2023-03-10,"Miami Lakes","Florida",5,0,5,"Three women and two men, including the perpetrator, were killed in their home during a murder–suicide.",2023,1,"Mar",10,"Mar 10","Fri",25.9125,-80.3214
"1023",2023-03-08,"Los Angeles","California",1,3,4,"A career criminal opened fire on police officers in the Lincoln Heights neighborhood, injuring three, before dying.",2023,1,"Mar",8,"Mar 8","Wed",34.1141,-118.4068
"1024",2023-03-08,"Pine Bluff","Arkansas",2,2,4,"Two people were killed and two others were injured in a parked car in front of an apartment complex.",2023,1,"Mar",8,"Mar 8","Wed",34.2116,-92.0173
"1025",2023-03-07,"Memphis","Tennessee",0,4,4,"Four people were injured, two critically, in south Memphis.",2023,1,"Mar",7,"Mar 7","Tue",35.1087,-89.9663
"1026",2023-03-06,"Memphis","Tennessee",2,2,4,"Two men were killed and two other people were critically injured at an apartment during a domestic incident.",2023,1,"Mar",6,"Mar 6","Mon",35.1087,-89.9663
"1027",2023-03-06,"La Riviera","California",2,2,4,"Two people were killed and two others injured in the early morning at a residential home. Two others in the home were not wounded.",2023,1,"Mar",6,"Mar 6","Mon",38.5683,-121.3544
"1028",2023-03-05,"Lake City","Florida",0,4,4,"Four men were wounded shortly before noon, the same suspect reportedly opened fire again after 30 minutes but no one else was wounded.",2023,1,"Mar",5,"Mar 5","Sun",30.1901,-82.6471
"1029",2023-03-05,"Bolingbrook","Illinois",3,1,4,"An adult and two teenagers were killed in an apparent home invasion, with a second adult wounded. A teenager was later arrested in connection.",2023,1,"Mar",5,"Mar 5","Sun",41.6901,-88.1021
"1030",2023-03-05,"Shreveport","Louisiana",0,4,4,"Four people were injured in the parking lot of a Baptist church during a drive-by shooting.",2023,1,"Mar",5,"Mar 5","Sun",32.4653,-93.7955
"1031",2023-03-04,"Cape Girardeau","Missouri",0,5,5,"Four victims with gunshot wounds were found by first responders at a bar, and a fifth person was later identified to be a victim of the same incident.",2023,1,"Mar",4,"Mar 4","Sat",37.3109,-89.5597
"1032",2023-03-04,"Douglasville","Georgia",2,6,8,"Two teenagers were killed and six others were injured during a shooting at a house party.",2023,1,"Mar",4,"Mar 4","Sat",33.7384,-84.7054
"1033",2023-03-04,"Los Angeles","California",0,5,5,"Five people were injured, one critically, near a beach in the San Pedro neighborhood.",2023,1,"Mar",4,"Mar 4","Sat",34.1141,-118.4068
"1034",2023-03-01,"Kansas City","Missouri",1,3,4,"Three police officers were injured while executing a search warrant at a home. The perpetrator died of a self-inflicted gunshot wound after an 18-hour standoff.",2023,1,"Mar",1,"Mar 1","Wed",39.1238,-94.5541
"1035",2023-03-01,"Cocoa","Florida",4,0,4,"Four people were killed in a domestic incident at their home.",2023,1,"Mar",1,"Mar 1","Wed",28.382,-80.7675
"1036",2023-02-27,"New Richmond","Ohio",4,1,5,"Four people were killed and one person was critically injured at a home during a murder–suicide.",2023,1,"Feb",27,"Feb 27","Mon",38.962,-84.2779
"1037",2023-02-27,"Memphis","Tennessee",2,2,4,"Two men were killed and two others were injured during a shooting near a park in South Memphis.",2023,1,"Feb",27,"Feb 27","Mon",35.1087,-89.9663
"1038",2023-02-26,"Machesney Park","Illinois",0,4,4,"Four people were injured, one critically, at a bar.",2023,1,"Feb",26,"Feb 26","Sun",42.3666,-89.0266
"1039",2023-02-26,"Pompano Beach","Florida",2,2,4,"Two people were killed and two others were injured during a shooting in front of a convenience store.",2023,1,"Feb",26,"Feb 26","Sun",26.2428,-80.1312
"1040",2023-02-26,"Memphis","Tennessee",1,4,5,"One person was killed and four others were injured, two critically, during a shooting near an intersection in Southwest Memphis.",2023,1,"Feb",26,"Feb 26","Sun",35.1087,-89.9663
"1041",2023-02-26,"Detroit","Michigan",2,2,4,"Two men were killed and two other people were injured during a shooting on Detroit's East Side.",2023,1,"Feb",26,"Feb 26","Sun",42.3834,-83.1024
"1042",2023-02-25,"Saint Paul","Minnesota",2,3,5,"Two people were killed and three others injured by gunfire after a confrontation ensued in the parking lot of a senior housing community.",2023,1,"Feb",25,"Feb 25","Sat",NA,NA
"1043",2023-02-25,"West Palm Beach","Florida",1,3,4,"One woman was killed and three men were injured during a shooting at an apartment.",2023,1,"Feb",25,"Feb 25","Sat",26.7469,-80.132
"1044",2023-02-23,"Philadelphia","Pennsylvania",0,7,7,"Three suspected shooters injured seven people, including a two-year old, five teenagers and one woman near a school in the Strawberry Mansion neighborhood of North Philadelphia.",2023,1,"Feb",23,"Feb 23","Thu",40.0077,-75.1339
"1045",2023-02-22,"Pine Hills","Florida",3,2,5,"Killing of Dylan Lyons: A shooter killed a woman and fled the scene, before returning to the scene multiple hours later and opening fire, killing a Spectrum News 13 reporter and critically injuring the photographer, then killed a nine year old and injured their mother at a home before being taken into custody.",2023,1,"Feb",22,"Feb 22","Wed",28.5818,-81.4692
"1046",2023-02-21,"Colorado Springs","Colorado",0,5,5,"Five people, including a bystander, were injured outside of a gas station after a planned confrontation between two groups escalated.",2023,1,"Feb",21,"Feb 21","Tue",38.8674,-104.7605
"1047",2023-02-20,"Cataño","Puerto Rico",3,2,5,"Two men and a boy were killed at a birthday party, and two other children were wounded. Police stated the shooting may have been related to drug trafficking.",2023,1,"Feb",20,"Feb 20","Mon",18.4375,-66.144
"1048",2023-02-19,"Chicago","Illinois",3,3,6,"Three people were killed and three others were injured along a northbound lane of I-57 in the South Side.",2023,1,"Feb",19,"Feb 19","Sun",41.8375,-87.6866
"1049",2023-02-19,"New Orleans","Louisiana",1,4,5,"One man was killed and four others were injured at an intersection along a parade route.",2023,1,"Feb",19,"Feb 19","Sun",30.0687,-89.9288
"1050",2023-02-19,"Linden","New Jersey",4,0,4,"Two parents and their two teenage children were killed in a murder–suicide at their home.",2023,1,"Feb",19,"Feb 19","Sun",40.6251,-74.2383
"1051",2023-02-19,"St. Louis","Missouri",0,4,4,"One woman and three men were injured during a shooting in Downtown St. Louis.",2023,1,"Feb",19,"Feb 19","Sun",38.6359,-90.2451
"1052",2023-02-19,"Memphis","Tennessee",1,10,11,"Seven people were injured at a Live Lounge. Four others were shot, one fatally, at a related shooting nearby.",2023,1,"Feb",19,"Feb 19","Sun",35.1087,-89.9663
"1053",2023-02-19,"Indianapolis","Indiana",0,5,5,"Five people were injured, one critically, at a gas station.",2023,1,"Feb",19,"Feb 19","Sun",39.7771,-86.1458
"1054",2023-02-18,"Columbus","Georgia",2,2,4,"Two men were killed and two children were injured during a shooting at a motel.",2023,1,"Feb",18,"Feb 18","Sat",32.51,-84.8771
"1055",2023-02-18,"Galena Park","Texas",5,2,7,"A man sexually assaulted a 12-year-old girl before fatally shooting three teenage girls, one of whom was pregnant, during a domestic dispute. An infant and a juvenile were also hospitalized. He then committed suicide in his bedroom.",2023,1,"Feb",18,"Feb 18","Sat",29.7452,-95.2333
"1056",2023-02-18,"Horry County","South Carolina",0,4,4,"Four people injured outside of Loris.",2023,1,"Feb",18,"Feb 18","Sat",NA,NA
"1057",2023-02-17,"Columbus","Georgia",0,9,9,"Nine juveniles were injured at a gas station.",2023,1,"Feb",17,"Feb 17","Fri",32.51,-84.8771
"1058",2023-02-15,"Baltimore","Maryland",0,4,4,"Four people, including two teenagers, were shot and wounded outside of a gas station in southeastern Baltimore.",2023,1,"Feb",15,"Feb 15","Wed",39.3051,-76.6144
"1059",2023-02-15,"El Paso","Texas",1,3,4,"A gunman opened fire in the Cielo Vista Mall, killing one person and injuring three others.",2023,1,"Feb",15,"Feb 15","Wed",31.8476,-106.43
"1060",2023-02-14,"Buffalo","New York",0,5,5,"Five people were injured after an altercation escalated.",2023,1,"Feb",14,"Feb 14","Tue",42.9018,-78.8487
"1061",2023-02-14,"Sweetwater","Tennessee",1,4,5,"One person was killed and five others, including a child, were injured at a residence.",2023,1,"Feb",14,"Feb 14","Tue",35.6029,-84.4716
"1062",2023-02-14,"Pittsburgh","Pennsylvania",0,4,4,"Four teenagers were shot outside Westinghouse High School.",2023,1,"Feb",14,"Feb 14","Tue",40.4397,-79.9763
"1063",2023-02-13,"East Lansing","Michigan",4,5,9,"2023 Michigan State University shooting: Eight students were shot, three fatally, at Michigan State University. The shooter, a 43-year-old man with no known ties to the school, committed suicide as he was being approached by police.",2023,1,"Feb",13,"Feb 13","Mon",42.748,-84.4836
"1064",2023-02-13,"Paterson","New Jersey",0,4,4,"Two teenagers and two adults were shot and wounded.",2023,1,"Feb",13,"Feb 13","Mon",40.9147,-74.1624
"1065",2023-02-12,"Louisville","Mississippi",1,5,6,"Six people were injured after multiple shooters opened fire in a parking lot.",2023,1,"Feb",12,"Feb 12","Sun",33.1224,-89.0553
"1066",2023-02-10,"New York City","New York",0,4,4,"Four people were wounded in a drive-by shooting outside a smoke shop in Coney Island, Brooklyn.",2023,1,"Feb",10,"Feb 10","Fri",NA,NA
"1067",2023-02-10,"New York City","New York",2,2,4,"A 24-year-old person was killed, and three additional people were wounded outside a Popeyes restaurant in the Crotona neighborhood of the Bronx.",2023,1,"Feb",10,"Feb 10","Fri",NA,NA
"1068",2023-02-09,"Harvey","Louisiana",4,0,4,"A man fatally shot three of his family members at their home before committing suicide.",2023,1,"Feb",9,"Feb 9","Thu",29.8876,-90.0666
"1069",2023-02-08,"Laurinburg","North Carolina",0,4,4,"Three teenagers and one man were injured during a drive-by shooting.",2023,1,"Feb",8,"Feb 8","Wed",34.7602,-79.4773
"1070",2023-02-08,"New Orleans","Louisiana",2,5,7,"Two adults were killed and five other people, including two children, were injured in a vehicle at an intersection in New Orleans East.",2023,1,"Feb",8,"Feb 8","Wed",30.0687,-89.9288
"1071",2023-02-08,"Elizabeth City","North Carolina",0,4,4,"Four teenagers were injured.",2023,1,"Feb",8,"Feb 8","Wed",36.2942,-76.236
"1072",2023-02-06,"Corpus Christi","Texas",1,4,5,"A 20-year-old woman was killed and four other people were injured after an argument between a group of people in two cars and a group of people at a home escalated.",2023,1,"Feb",6,"Feb 6","Mon",27.7254,-97.3767
"1073",2023-02-05,"Stockton","California",1,3,4,"One man was killed and three others were injured in downtown Stockton.",2023,1,"Feb",5,"Feb 5","Sun",37.9765,-121.3109
"1074",2023-02-05,"Tucson","Arizona",1,3,4,"One man was killed and three teenage boys were injured, one critically, at a house party in Southeast Tucson.",2023,1,"Feb",5,"Feb 5","Sun",32.1541,-110.8787
"1075",2023-02-05,"Newport","Arkansas",1,4,5,"One woman was killed and three were injured after two shooters opened fire at a concert.",2023,1,"Feb",5,"Feb 5","Sun",35.6234,-91.2322
"1076",2023-02-05,"Falcon","Colorado",1,4,5,"One person was killed and four were injured after an unknown shooter opened fire in the Meridian Ranch neighborhood. Authorities believe the shooting is linked to a carjacking from the day before.",2023,1,"Feb",5,"Feb 5","Sun",NA,NA
"1077",2023-02-04,"Huntsville","Texas",2,2,4,"Two people were killed and two others were critically injured after two shooters opened fire at a house party near Sam Houston State University.",2023,1,"Feb",4,"Feb 4","Sat",30.7009,-95.5567
"1078",2023-02-01,"Los Angeles","California",0,5,5,"Five people were injured in a drive-by shooting in South Los Angeles.",2023,1,"Feb",1,"Feb 1","Wed",34.1141,-118.4068
"1079",2023-02-01,"Texas City","Texas",0,4,4,"Four people were shot, one critically, at an apartment complex. Two children were present, but were left unharmed.",2023,1,"Feb",1,"Feb 1","Wed",29.4154,-94.9682
"1080",2023-01-31,"Durham","North Carolina",2,2,4,"Four men were shot, two fatally, in a neighborhood of Durham.",2023,1,"Jan",31,"Jan 31","Tue",35.9792,-78.9022
"1081",2023-01-30,"Lakeland","Florida",0,11,11,"Eleven people were injured, two critically, during a targeted attack at a neighborhood intersection one mile north of downtown Lakeland. The perpetrator was killed by police seven days later in a car chase.",2023,1,"Jan",30,"Jan 30","Mon",28.0557,-81.9545
"1082",2023-01-30,"Dallas","Texas",1,3,4,"One man was killed and three other people, including a child, were injured in southern Dallas.",2023,1,"Jan",30,"Jan 30","Mon",32.7935,-96.7667
"1083",2023-01-29,"Greensboro","North Carolina",1,6,7,"One person was killed and six people were injured during a shooting at a nightclub.",2023,1,"Jan",29,"Jan 29","Sun",36.0956,-79.8271
"1084",2023-01-29,"Columbus","Ohio",1,3,4,"One person was killed and three people were injured after two shooters opened fire at a strip club in northeast Columbus.",2023,1,"Jan",29,"Jan 29","Sun",39.9862,-82.9855
