2024 date,Location,State or territory,Dead,Injured,Total,Description
June 15,Cincinnati (1),Ohio,0,5,5,Five people were wounded in a shooting at an event being held at a park in the Madisonville neighborhood in the city's northeast side.[311]
June 15,Lathrup Village,Michigan,0,6,6,"A shooting at a party being held at a home wounded six, including several teenagers.[312]"
June 15,Tuskegee (1),Alabama,1,3,4,"A shooting at a gas station killed a man and injured three others, including a city fire marshal.[313]"
June 15,Rochester Hills,Michigan,1[n 1],9,10,"2024 Rochester Hills shooting: A man pulled up and exited his vehicle, approached a splash pad before opening fire, wounding nine people, including two children. The suspect died of a self-inflicted gunshot wound hours later after barricading himself in a house.[314][315]"
June 14,Mercer County,West Virginia,0,5[n 2],5,"Two family members opened fire on each other at a Days Inn east of Lilly Grove. One shooter and four bystanders, including a five-year-old, were struck by gunfire.[316]"
June 14,Franklin Park,Florida,1,4,5,A man was killed and four others were injured in a drive-by shooting.[317]
June 14,Columbus (3),Ohio,2,2,4,"Four people were shot, with two men being killed, at a nightclub in Downtown Columbus.[318]"
June 14,Chicago (11),Illinois,0,4,4,A drive-by shooting in the Calumet Heights community in the city's south side left three men and a woman injured.[319]
June 13,Chicago (10),Illinois,0,4,4,A drive-by shooting in the West Pullman community in the city's south side left three women and a man injured.[320]
June 12,Pasco County (1),Florida,4,0,4,A family of four was murdered and set ablaze east of Hudson. Officers found the bodies inside the burn pit two days later and arrested the suspect the next day.[321]
June 11,La Junta,Colorado,4[n 1],0,4,A murder-suicide at a home left two adults and two children dead.[322]
June 11,Lost Nation,Illinois,0,4[n 1],4,"Police responded to a person barricaded in a home threatening suicide. Police were then fired upon from inside the home, striking three officers, before the shooter was shot and injured and taken into custody.[323]"
June 11,Atlanta (4),Georgia,0,4[n 1],4,A man shot three people after an altercation at a mall food court in the Peachtree Center of Downtown Atlanta before being shot by a police officer.[324]
June 11,Memphis (7),Tennessee,0,5,5,"Four minors and an adult were injured in a shooting on I-240 in East Memphis. A car chase then occurred as police chased the suspects believed to be involved in the shooting, which resulted in an officer crashing in Raleigh. The suspects later crashed and were detained in Frayser.[325][326]"
June 9,Dallas (3),Texas,0,4,4,Three men and a teenage boy were shot in the Deep Ellum neighborhood in the city's east side overnight.[327]
June 9,Richmond (3),Virginia,0,4,4,Four people were shot in Downtown Richmond shortly before midnight.[328]
June 9,Washington (7),District of Columbia,0,6,6,"Six people were injured in a shooting in the Fairlawn neighborhood of Southeast DC, including three teenagers, during the late afternoon. A police officer crashed and was injured while responding to the scene.[329]"
June 9,Madison,Wisconsin,0,10,10,"Ten people were shot after at least one person opened fire at a rooftop party at an apartment complex near the University of Wisconsin–Madison campus, including several teenagers. Two people suffered other injuries.[330][331]"
June 8,Eufaula,Alabama,0,4,4,Four people were shot at a block party during the evening hours.[332]
June 8,Charlotte (3),North Carolina,0,4,4,"An argument in a business parking lot escalated when a man retrieved a firearm from his car and opened fire, striking four, in the Fourth Ward.[333]"
June 8,Sioux Falls (1),South Dakota,3,2,5,Three adults were found dead overnight and two others injured after police responded to a disturbance call.[334][335]
June 7,Beaufort County,South Carolina,0,4,4,A teenage girl was among four wounded in a shooting at a graduation party being held in the yard of a home east of Sheldon.[336]
June 7,Compton (3),California,1,5,6,One person was killed and five were injured in a shooting at a backyard birthday party in the evening.[337]
June 7,Jennings,Missouri,1,4,5,A shooting at a park left a man dead and four other men injured during the afternoon.[338]
June 6,Kansas City (6),Missouri,2,2,4,"A shooting at a home in a domestic violence incident left a man and a boy dead and two others, including another boy, injured in the Oak Park Northwest neighborhood.[339]"
June 3,Philadelphia (6),Pennsylvania,0,4,4,"Two men riding a moped opened fire on a group in the Fairhill neighborhood in the city's north side, wounding four, including two teenagers.[340]"
June 3,Dumfries,Virginia,1,3,4,"A 15-year-old boy was killed and three others, including two other teenagers, were wounded in a shooting during the late evening.[341]"
June 3,Memphis (6),Tennessee,0,4,4,Four people were wounded in a shooting in the Raleigh neighborhood in the city's north side.[342]
June 2,Pensacola,Florida,0,4,4,A large fight escalated into a shooting that wounded four shortly after midnight.[343]
June 2,St. Louis (2),Missouri,0,6,6,Six people were shot outside a bar in the Fairgrounds neighborhood in the city's north side.[344]
June 2,Newport News,Virginia,0,4,4,Four men were shot in the Chestnut neighborhood during the early morning hours.[345]
June 2,Penn Hills,Pennsylvania,2,7,9,A man and a woman were killed and seven others were injured in an exchange of gunfire inside a bar.[346]
June 2,Louisville (4),Kentucky,0,6,6,Six minors were wounded in a shooting during a party at a business.[347]
June 2,Akron (1),Ohio,1,29,30,A man was killed and at least twenty-nine others were injured in an overnight shooting at a street party.[348]
June 2,Kendale Lakes,Florida,4[n 1],0,4,Police discovered four bodies inside a home during afternoon. It was learned that a man fatally shot his parents and his partner before turning the gun on himself.[349]
June 1,Philadelphia (5),Pennsylvania,1,3,4,A shooting in the Cobbs Creek neighborhood in the city's west side left one man dead and three others injured.[350]
June 1,Columbus (2),Ohio,1,3,4,A man was killed and three others were injured in a shooting in the Mount Vernon neighborhood on the city's east side.[351]
June 1,Rock Hill,South Carolina,2,2,4,A man and a woman were killed and two others were injured in a shooting during a block party.[352]
June 1,Detroit (4),Michigan,1,3[n 1],4,"Four people were wounded in a shooting at a block party in the Miller Grove neighborhood on the city's westside, including a suspect by police gunfire.[353][354] One of the victims later died of her injuries.[355]"
June 1,Santan,Arizona,2,4,6,"Two people, including a police officer, were killed when at least one person opened fire on a crowd outside a home in the Gila River Indian Community during the early morning. Four others were injured, including another police officer.[356]"
May 30,DeKalb County,Georgia,0,6,6,A shootout at a home east of Candler-McAfee injured six men.[357]
May 30,Elkridge,Maryland,4[n 1],1,5,"A man fatally shot his wife, daughter, and daughter-in-law and injured his son before committing suicide at a town-home. A three-month-old baby was left unharmed.[358]"
May 30,Minneapolis (2),Minnesota,4[n 1],3,7,"2024 Minneapolis shooting: Two men were shot and killed in an apartment building in the Whittier neighborhood by a gunman. The gunman exchanged fire with police who responded to the scene, killing one officer and injuring three other people. The gunman was then killed. One injured victim later succumbed to his wounds on June 9.[359][360][361][362]"
May 28,Waterbury,Connecticut,0,4,4,Four people were shot during the late afternoon.[363]
May 27,Richmond (2),Virginia,2,2,4,"A 15-year-old boy and a man were killed and two others, including another teenager, were wounded in a shooting shortly before midnight in the Whitcomb neighborhood on the city's East End.[364]"
May 27,Sacramento,California,0,5,5,Five people were shot at an apartment complex in the Meadowview neighborhood on the city's south side.[365]
May 27,Lansing,Michigan,1,6,7,"A 17-year-old was killed and six other people, mostly teenagers, were injured in a late night shooting at a park in Downtown Lansing.[366]"
May 26,Chicago (9),Illinois,1,3,4,"A man was killed and three others, including a teenager, were injured in a shooting in the North Lawndale neighborhood of the city's West Side during the early morning.[367]"
May 26,Kansas City (5),Missouri,1[n 1],5,6,A man shot five people in the entertainment district of Westport on the city's south side before he was fatally shot by a public safety officer.[368]
May 26,Cleveland (1),Ohio,1,3,4,A man was killed and three other people were injured in a late night shooting in Downtown Cleveland.[369]
May 25,San Fernando,California,0,5,5,A man shot five people at a home before barricading himself. During a stand-off with police the man fired shots at an LAPD helicopter before he was arrested.[370]
May 25,North St. Paul,Minnesota,0,4,4,"Four people were injured, including a teenage boy, in a shooting at a park during the evening hours.[371]"
May 25,Fort Pierce (2),Florida,0,5,5,"Five people, including three teenagers, were wounded in a shooting shortly after midnight.[372]"
May 24,Hopkins Park,Illinois,2,3,5,Three people were injured and two were killed in a shooting during a party at a banquet hall shortly before midnight.[373]
May 22,Chester (1),Pennsylvania,2,3,5,"A man armed with a handgun shot five people at a linen business, killing two. The suspect was allegedly a disgruntled employee.[374]"
May 21,Harrisburg (2),Pennsylvania,0,4,4,Three people were found shot at an intersection in the Allison Hill neighborhood. A fourth person was also found shot on the next street over.[375]
May 21,Chicago (8),Illinois,0,4,4,Four men who were walking were shot when someone in a car pulled up and opened fire in the North Lawndale neighborhood on the city's west side.[376]
May 20,Detroit (3),Michigan,1,4,5,"A verbal argument escalated when a man pulled out a gun and fired multiple shots, killing another man and wounding four other people in the Bagley neighborhood in the city's northwest side.[377]"
May 18,Caswell County,North Carolina,3[n 1],2,5,A man fatally shot a woman and a juvenile and injured two other juveniles at a home in Stoney Creek Township. Alamance County deputies spotted the shooter in a car in Burlington and after commanding him to surrender he fatally shot himself.[378]
May 18,St. Louis (1),Missouri,1,3,4,A shooting in the Midtown neighborhood killed a man and injured three others.[379]
May 18,Bridgeton,Missouri,0,5,5,"Police responded to calls of around 100 vehicles being driven recklessly on Missouri Route 141 and a connecting road. Once police arrived they were fired upon from multiple vehicles and five people were struck by gunfire, none of them being officers.[380]"
May 18,Savannah,Georgia,0,11,11,"Shortly before midnight, a dispute between two women led to a shooting that left eleven people injured in Ellis Square.[381]"
May 18,Chicago (7),Illinois,0,6,6,"Three people opened fire on a group of men in the East Garfield Park neighborhood on the city's west side, wounding six.[382]"
May 18,Fort Pierce (1),Florida,3[n 1],1,4,"A man shot three, mortally wounding two, before being killed by police.[383]"
May 18,Sarasota County,Florida,1,4,5,A shooting during the early morning at a shopping plaza just outside of Sarasota killed one and injured four.[384]
May 18,Columbus (1),Ohio,3,3,6,An early morning shooting between the Weinland Park and Italian Village neighborhoods resulted in three people killed and three others wounded.[385]
May 12,Ridgeland,Mississippi,4[n 1],0,4,A man fatally shot his mother and his two adult sisters at a home before fleeing the state. Arizona Highway Patrol officers located him on U.S. 191 a day after the murders between Morenci and Clifton where he was fatally shot after brandishing a firearm at police.[386][387]
May 12,Riverview,Missouri,1,3,4,A 15-year-old boy was killed and three others were injured in a shooting during the evening hours.[388]
May 12,Tallahassee,Florida,2,2,4,Two men were killed and two others were injured in a shooting at a shopping center during the early morning hours.[389]
May 12,Northborough,Massachusetts,1,3,4,Shortly after midnight a partygoer flagged down police officers and told them that someone at a house party was brandishing a firearm. When police arrived they heard gunshots and found four people had been shot. A 16-year-old boy was killed.[390]
May 12,Atlanta (3),Georgia,2,4,6,Two people were killed and four were injured after a fight at a nightclub escalated into a shooting in the Colonial Homes neighborhood.[391]
May 11,Atlanta (2),Georgia,1[n 1],3,4,"Officers responded to a report of an armed man in the Capitol View neighborhood. When they arrived, they found a man armed with a handgun, and when one of them attempted to restrain him, he opened fire and struck three of them. They then returned fire, killing him.[392]"
May 11,Baldwin County,Alabama,3,15,18,Three people were killed and fifteen were injured in a shooting at a May Day event being held in a field north of Stockton.[393]
May 11,Louisville (3),Kentucky,2,2,4,Two men were killed and two others were injured in a shooting at a bar in the Southland Park neighborhood.[394]
May 8,Durham (1),North Carolina,1,3,4,"A man shot three men and a woman at an apartment complex, killing one of the men.[395]"
May 8,Bexar County,Texas,1,4,5,"Two people opened fire at a home in a targeted attack just outside of San Antonio, striking five, including three children. A four-year-old was killed.[396]"
May 8,Gwinnett County (2),Georgia,4[n 1],0,4,A man killed three children he was babysitting at a park before he killed himself just north of Tucker.[397]
May 6,Fort Wayne (1),Indiana,0,4,4,A large fight escalated into a shooting that wounded four in the Pettit-Rudisill neighborhood.[398]
May 5,Gallup,New Mexico,2,2,4,"A man shot four people, including a child, at a shopping mall during the early morning hours. Two men were killed.[399]"
May 5,Huntsville (1),Alabama,0,5,5,A shooting at a bar wounded five during the late evening hours.[400]
May 5,Birmingham (2),Alabama,1,6,7,A shooting outside a gas station in the Bush Hills neighborhood left one dead and six injured.[401]
May 5,Tuscaloosa County (2),Alabama,1,3,4,"An altercation at a home just outside of Tuscaloosa escalated into a shooting, leaving one dead and three injured.[402]"
May 4,Fresno (1),California,0,5,5,"A man got into an argument at a family gathering at a home. The man then returned to the gathering armed with two of his brothers, striking five, including a five-year-old and a teenager, as well as both of his brothers.[403]"
May 4,Buffalo,New York,1,5,6,A shooting at a house party in the Cold Springs neighborhood killed a 14-year-old girl and wounded five other teenagers.[404]
May 4,Long Beach,California,0,7,7,"Two people opened fire on a group outside a nightclub in the Davenport Park neighborhood, injuring seven, in what is believed to be a gang-related incident.[405]"
May 4,New York City (5),New York,1,3,4,A shooting at an event center where a baby shower was being held in the Richmond Hill area of Queens killed a man and injured three other men.[406]
May 4,Memphis (5),Tennessee,1,3,4,"Four people were shot, one fatally, near a shopping center in the Hickory Hill neighborhood.[407]"
May 4,Philadelphia (4),Pennsylvania,1,3,4,"An 18-year-old was killed and three others, including two other teenagers, were injured in a shooting at a home in the Kingsessing neighborhood.[408]"
May 3,Pulaski County & Russell County,Kentucky,3[n 1],1,4,"A woman fatally shot her husband outside their home in Pulaski County before driving southwest to the home of her sister in Russell County where she fatally shot her sister. She then drove northeast to the home of her brother where she forced herself inside, injuring him before he mortally wounded her in self-defense.[409]"
May 3,Westbury,New York,0,6,6,"Six people were shot at a birthday party, five of whom were minors.[410]"
May 2,Henrico County (1),Virginia,1,3,4,A shooting at an apartment complex during a cook-out killed a man and injured three other men just north of Richmond.[411]
May 1,Detroit (2),Michigan,0,4,4,"An altercation between two women at a park near Frank Cody High School on the city's west side lead to a man opening fire, hitting two women and two children. One of the women shot is pregnant.[412]"
May 1,Fort Worth (1),Texas,0,6,6,"A drive-by shooting outside an apartment complex wounded six, the youngest of whom was three years old and the oldest of whom was 19 years old.[413]"
April 29,Charlotte (2),North Carolina,5[n 1],4,9,2024 Charlotte shootout: Four police officers were killed and four others were injured in a shootout during a U.S. Marshals task force search for a wanted fugitive in the Shannon Park neighborhood. The subject of the warrant was also killed.[414][415]
April 29,Miami Gardens (1),Florida,0,5,5,"A fight amongst a group of students at Miami Norland Senior High School was brought off-campus to be discussed among a group of adults and teenagers. During the discussion, another fight occurred and an adult pulled out a gun and opened fire, striking two teenagers and three adults.[416]"
April 28,Hinds County,Mississippi,1,4,5,An argument among a group at a club just northeast of Utica escalated into a shooting that killed a man and injured four others.[417]
April 28,Kenner,Louisiana,1[n 1],5,6,"A man wanted for an armed robbery and shooting the previous week shot two more men whom he mistook for undercover police officers, which led to a standoff in which he shot three police officers before being killed by a police sniper.[418]"
April 28,Seminole County,Florida,0,10,10,"Ten people were shot when a 16-year-old boy opened fire early Sunday during a verbal altercation at Cabana Live, a restaurant and event venue near Sanford. The suspect was apprehended and booked into the juvenile detention center.[419][420]"
April 28,San Antonio (3),Texas,2[n 1],4,6,Two people were killed and four were injured in a late-night shootout involving police officers at Market Square during the Festival San Antonio. An 18-year-old man shot and killed another man before being fatally shot by police. Four bystanders were injured.[421][422]
April 28,Tucson (1),Arizona,1,3,4,A shooting during a party at a home killed a young woman and injured three others.[423]
April 28,Fitzgerald,Georgia,1,3,4,A 15-year-old opened fire at an after-prom party and killed another 15-year-old and wounded three other teenagers.[424]
April 27,Orangeburg County,South Carolina,1,3,4,A 16-year-old opened fire shortly after midnight at the end of an after-prom party for Lake Marion High School students and killed a 19-year-old and wounded three others.[425]
April 27,Mobile (2),Alabama,0,5[n 2],5,Five people were injured when two people opened fire upon each other at a barber shop in the Pleasant Valley neighborhood.[426]
April 27,Daytona Beach,Florida,0,4,4,Four people were injured after a street fight turned into a shooting in the Seabreeze neighborhood.[427]
April 26,Washington (6),District of Columbia,0,6,6,"A man who was kicked out of a bar pulled out a gun and shot six people, including a security guard, in the Dupont Circle neighborhood of in Northwest DC.[428]"
April 24,Springdale,Arkansas,2[n 1],2,4,A man shot and killed a woman and wounded two other people in a car before killing himself.[429]
April 22,Dinwiddie County,Virginia,0,5,5,"Five people, including two teenagers, were injured in a drive-by shooting outside an apartment complex southwest of Petersburg.[430]"
April 22,Oklahoma City (2),Oklahoma,5[n 1],0,5,A man killed his wife and three of their children before killing himself in their home near Yukon. A fourth child was found unharmed.[431]
April 21,Oak Forest,Illinois,1,3,4,"Two teenage girls and a 12-year-old girl were shot in a neighborhood. Authorities then tracked down and stopped a car believed to be involved in the shooting. Inside they found two people, one with a mortal gunshot wound to the head and a person of interest who was arrested.[432]"
April 20,Memphis (4),Tennessee,2,7,9,"At least two shooters opened fire and killed two people, while wounding seven others at a large block party being held at a park in the Orange Mound neighborhood.[433]"
April 20,Weirton,West Virginia,3[n 1],1,4,A man fatally shot two women and injured another at a home before committing suicide.[434]
April 19,Washington (5),District of Columbia,0,4,4,"A drive-by shooting outside a convenience store in the Trinidad neighborhood of Northeast DC wounded four, including a teenager.[435]"
April 19,Greenbelt,Maryland,0,5,5,"Around 500 juvenile and young adult students gathered at a park for ""senior skip day"" for a water gun fight. During the fight, someone opened fire with an actual gun, striking five teenagers.[436]"
April 18,Chackbay,Louisiana,0,4,4,A fight among a group of people escalated into a shooting that wounded four during the evening hours.[437]
April 16,New York City (4),New York,1,3,4,One person was killed and three were injured by two shooters riding scooters in the Mount Eden neighborhood of The Bronx.[438]
April 16,Sampson County,North Carolina,1,3,4,A man was killed and three others were injured south of Clinton.[439]
April 14,Hopkinsville,Kentucky,0,4,4,"A drive-by shooting outside a county health department office wounded four, including three juveniles.[440]"
April 14,New Orleans (3),Louisiana,1,11,12,A shooting at a nightclub in the Lower Garden District killed a woman and injured eleven others.[441]
April 14,Richmond (1),Virginia,1,3,4,A teenager was killed and three others were injured in a shooting outside a home in the Montrose Heights neighborhood.[442]
April 14,Dallas (2),Texas,1,8,9,A shooting believed to have stemmed from gang violence killed a woman and injured eight others after a large party went out onto the street in South Dallas.[443]
April 14,Nashville (3),Tennessee,0,6,6,An argument between the two individuals escalated into a shooting that left six people injured near a nightclub in South Nashville.[444]
April 13,Coldwater,Mississippi,1,3,4,A man was killed and three others were injured in a shooting at a home during the morning hours.[445]
April 13,Albany (1),Georgia,0,4,4,"A fight at a nightclub between gang members escalated when a man fired shots into a crowd, striking four, during the early morning hours.[446]"
April 13,Chicago (6),Illinois,1,10,11,"A child was killed and ten others, including three other children, were injured when three shooters walked up to a street and opened fire at a remote crowd during a family gathering in the Back of the Yards neighborhood on the South Side.[447]"
April 13,Wynne,Arkansas,1,9,10,A man was killed and nine others were injured in a shooting erupted at a block party during the evening hours.[448]
April 12,Memphis (3),Tennessee,2[n 2],3[n 2],5,"Two suspects engaged in a shootout with Memphis Police Department officers, leaving a suspect and a police officer dead and the other suspect and two others wounded. The dead officer was killed by friendly fire from other officers.[449][450]"
April 11,Lockhart,Florida,1,3,4,"Four men were shot, one fatally, near an apartment complex during the evening hours in a targeted attack.[451]"
April 10,Washington (4),District of Columbia,1,5,6,"One man was killed and five others injured, including two children, in Northeast DC.[452]"
April 9,Tampa (1),Florida,0,4[n 1],4,Three women were injured after a verbal altercation between two groups of teenagers escalated into a shooting near Armature Works in Tampa Heights. A teenager who was involved in the shooting was also injured and later arrested.[453]
April 7,Oklahoma City (1),Oklahoma,1,3,4,"Four bystanders to a fight in an event center parking lot in the Grand Portland neighborhood were shot, with one woman being killed.[454]"
April 7,Washington (3),District of Columbia,0,4,4,Three men and a woman were shot in the Bellevue neighborhood of Southwest DC during the evening hours.[455]
April 7,San Antonio (2),Texas,0,6,6,"Six people, including three teenagers, were struck by gunfire in an event center parking lot in Uptown when they were fired upon from across the street.[456]"
April 6,Stockton,California,1,3,4,"A man was found in a car suffering a gunshot wound following reports of shots fired. Shortly afterwards, police engaged in a chase with a car believed to be involved with the previous shooting and after the vehicle was stopped, three teenagers were found inside injured. A teenage boy later died from his injuries.[457]"
April 6,Doral,Florida,2[n 1],7,9,"During a fight at a nightclub in the CityPlace Doral mall, a man pulled out a gun and shot a security guard who attempted to intervene, killing him. The man and the security team got into a shootout, ending with the gunman killed and seven people, including a police officer, wounded.[458]"
April 5,North Little Rock,Arkansas,1,3,4,A man fatally shot a woman in a car and injured three others in a domestic violence incident. The shooter was located by a police dog in an abandoned house and arrested.[459]
April 5,Riviera Beach,Florida,0,4,4,Three adults and a juvenile were shot at an intersection during the evening hours.[460]
April 2,Des Moines,Iowa,1,3,4,A shooting at an apartment complex in the McKinley School/Columbus Park neighborhood shortly before midnight killed one and injured three.[461]
April 1,Eastpointe,Michigan,0,4,4,"A victim's car was rammed into and at least one occupant in the ramming vehicle then opened fire, wounding four, including a pregnant woman.[462]"
