2024 date,Location,State or territory,Dead,Injured,Total,Description
August 18,Oklahoma City (3),Oklahoma,0,4,4,Four people were wounded when a person opened fire into a group of people in the Bricktown area of Downtown Oklahoma City. Two officers fired at the suspect before they eventually surrendered.[155]
August 18,Baltimore (3),Maryland,1,7,8,A man was killed and seven others were injured in a shooting at a gathering in the Oliver neighborhood.[156]
August 18,Boston (2),Massachusetts,0,5,5,Five people were shot at Franklin Park on the outskirts of the Dominican Festival.[157]
August 18,Minneapolis (4),Minnesota,0,4,4,"A group of five children stole a vehicle and were followed by another vehicle. After some time at least one occupant in the other vehicle opened fire in the Jordan neighborhood, striking four of the children. Two of the children had been arrested less than two weeks prior for stealing another vehicle.[158]"
August 17,Oakland (3),California,2,2,4,A crowded argument escalated into a shooting that killed two people and wounded two others in the city's east side.[159]
August 17,Jackson (4),Mississippi,1,5,6,An early morning shooting at a bar in Downtown Jackson killed one and injured five others.[160]
August 16,Memphis (9),Tennessee,0,4,4,A man shot four others outside a Midtown restaurant after arguing about a parking spot.[161]
August 14,Colorado Springs,Colorado,1,3,4,One person was killed and three people were injured in a shooting at the Sandcreek Commons Condos.[162]
August 14,Waianae (1),Hawaii,1[n 1],3,4,"A man chased a woman into a neighbor's home as a result of a domestic incident and began firing into the home, striking three people inside, before he was fatally shot by responding police.[163]"
August 14,Ettrick,Virginia,0,4,4,Four people were injured in an on-campus shooting at Virginia State University. None of the victims or suspects are students of the school.[164]
August 12,Indianapolis (7),Indiana,2[n 1],2,4,A man killed one person and wounded two adolescents before taking his own life.[165]
August 12,Lawrence,Massachusetts,1,3,4,"A man opened fire on his ex-girlfriend, her sister and brother, and her friend after he broke into their apartment. The man wounded his ex-girlfriend and her siblings and fatally shot her friend when he attempted to disarm him in a struggle.[166]"
August 12,Chicago (21),Illinois,0,4,4,Four people were injured in a shooting at a Near West Side club after an argument escalated.[167]
August 11,Tucson (2),Arizona,0,4,4,Four people were injured in a shooting.[168]
August 11,Sharpsburg,North Carolina,3[n 1],2,5,A man killed a woman and a six-year-old child while wounding two others before taking his own life in a domestic-related incident.[169]
August 10,Cleveland (2),Ohio,0,4,4,Four people were injured in a shooting at a car meet at the Lee Harvard Shopping Center in the Lee–Miles neighborhood.[170]
August 10,Jacksonville (2),Florida,0,6,6,Six people were shot outside of a pop-up nightclub in the Brentwood neighborhood.[171]
August 10,Atlanta (5),Georgia,0,5,5,"A shooting at an event left five people wounded, including three teens, near a park on the city's southwest side in the Mechanicsville neighborhood.[172]"
August 9,Dallas (5),Texas,0,4,4,Four people were injured in a shooting at Far North Dallas.[173]
August 9,Charlotte (6),North Carolina,0,4,4,A shooting at a Shell gas station injured four people on the city's south side in the Montclaire South neighborhood.[174]
August 9,Lexington,Kentucky,1,5,6,One person was killed and five others were injured in an overnight shooting.[175]
August 8,Birmingham (4),Alabama,2,2,4,"A man opened fire at two homes in the West End Manor neighborhood, killing two and injuring two others, in a domestic-related incident.[176]"
August 7,New York City (6),New York,0,6,6,Six men were injured near St. James Park when two other men pulled up on scooters and opened fire in the Fordham neighborhood of The Bronx.[177]
August 6,Morgan County,West Virginia,0,4,4,A fight at a house party at a home east of Berkeley Springs led to a shooting that wounded four.[178]
August 5,Seattle (1),Washington,0,4,4,A drive-by shooting on the edge of Downtown Seattle in Capitol Hill injured four people. One of the victims crashed his vehicle into the Swedish First Hill hospital while fleeing the scene.[179]
August 5,Beechwood,Mississippi,1,3,4,A teenager killed another teenager and injured three other people after a dispute over a stolen cell phone east of Vicksburg.[180]
August 5,Kansas City (7),Missouri,1,5,6,One person was killed and five others were injured after an argument escalated into a shootout at a gathering in the city's south side.[181]
August 4,Oakland (2),California,0,5,5,A shooting during a sideshow injured five in the Dimond District neighborhood on the city's east side.[182]
August 4,Memphis (8),Tennessee,0,4,4,Three women and a man were injured when four men opened fire on them outside a nightclub on the city's northeast side.[183]
August 4,Chicago (20),Illinois,0,5,5,Five men were shot in the Washington Park neighborhood in the city's south side. The five shooting victims were uncooperative with responding police.[184]
August 4,Chicago (19),Illinois,1,3,4,A man was killed and three others were injured in a shooting outside a restaurant in Chinatown on the city's south side.[184]
August 4,Tulsa,Oklahoma,0,8,8,Eight people were injured in an early morning shooting in the city's north side.[185]
August 3,Springfield,Ohio,0,5,5,Five people were injured in a shooting attack southeast of downtown Springfield. Multiple vehicles were shot during the attack.[186]
August 3,Washington (11),District of Columbia,2,2,4,Two people were killed and two were injured in a shooting in the NoMa neighborhood of Northeast DC.[187]
August 3,Milwaukee (6),Wisconsin,0,5,5,Five people were shot outside of a bar in the city's north side in the Williamsburg neighborhood.[188]
August 2,Charlotte (5),North Carolina,1,3,4,One person was killed and three others were injured in the city's east side near the Charlotte Museum of History.[189]
August 2,Lake County,Florida,4[n 2],2,6,"A woman called law enforcement for a well-being check on a nearby home east of Umatilla and when officers arrived it appeared that a home had been burglarized, and they ordered people they heard inside to come out. When the officers made entry they were fired upon by the woman's husband and two daughters. All three attackers and one of the deputies were killed, while two other deputies sustained gunshot wounds. The woman who called 911 was later arrested and charged with premeditated murder.[190][191]"
August 1,Aurora,Colorado,1,3,4,One person was killed and three others were injured in an afternoon shooting.[192]
July 30,South Fulton,Georgia,1,3,4,A shooting at a Shell gas station left one dead and three others injured.[193]
July 29,Portland,Maine,1,3,4,"Four people were shot, one fatally, in the parking lot of an auto repair shop in the North Deering neighborhood.[194]"
July 28,Auburn,Washington,0,4,4,"A group of four masked men opened fire on another group exiting a bus at a bus stop, injuring four, in what is believed to be a targeted attack. One of the victims in the group returned fire.[195]"
July 28,South Bend (2),Indiana,0,4,4,Four people were injured in the city's northeast side.[196]
July 28,St. Louis (5),Missouri,1,3,4,A woman was killed and three others were injured in a shooting at a restaurant in the Tower Grove East neighborhood on the city's south side.[197]
July 28,Escambia County,Florida,2,5,7,A drive-by shooting at a community center northwest of Brent where a basketball game was being held killed two people and injured five others.[198]
July 28,Los Angeles (4),California,0,4,4,"Four people, including a 14-year-old boy, were wounded in a drive-by shooting in the South Park neighborhood of South Los Angeles.[199]"
July 28,Rochester (2),New York,2,5,7,Two people were killed and five others were injured in a shooting in Maplewood Park in the Maplewood Historic District.[200]
July 28,Milwaukee (5),Wisconsin,0,5,5,Five teenagers were shot in the city's northwest side.[201]
July 28,Champaign,Illinois,2,2,4,"Three teenagers and a woman were shot in an apartment complex parking lot, with two of the teens being killed.[202]"
July 27,Dallas (4),Texas,0,5,5,"Three shooters opened fire at a gas station, wounding five, in the city's south side.[203]"
July 26,Kankakee,Illinois,0,6,6,A fight at a birthday party among a group of adults and juveniles at Pioneer Park escalated into a shooting that wounded six.[204]
July 25,Jeanerette,Louisiana,1,3,4,"A Lafayette police SWAT team member was killed and three others were wounded in a shootout during a hostage situation, in which a man wanted for a drive-by shooting barricaded himself inside a home with two others, including a juvenile.[205]"
July 24,Yancey County,North Carolina,0,4[n 1],4,Three people were injured when a man opened fire on a tree trimming crew. The suspect was shot by police before being taken into custody.[206]
July 23,Burton,South Carolina,0,4,4,Four people were shot inside a vehicle when they were fired upon by at least one other person inside another vehicle.[207]
July 22,Milwaukee (4),Wisconsin,1,8,9,A shooting in a Dineen Park parking lot left a teenage girl dead and eight others wounded.[208]
July 21,Anderson,Indiana,0,7,7,"A shooting at a block party injured seven people, including two teenagers.[209]"
July 21,Jackson (3),Mississippi,2,4,6,"A shooting at a Shell gas station killed two, including the owner, and injured four others.[210]"
July 21,Indianola,Mississippi,3[n 2],16,19,"Three men, including two suspects, were killed and sixteen people wounded in a shooting near a club.[211][212]"
July 21,Philadelphia (10),Pennsylvania,3,6[n 1],9,"An altercation at a block party escalated into a gunfight that killed three people and injured six others, including one of the shooters in the Carroll Park neighborhood of the city's west side.[213][214]"
July 20,Vista,California,1,3,4,A shooting killed a young man and injured three others.[215]
July 19,Broken Arrow,Oklahoma,4[n 1],0,4,"A man killed his brother, grandfather and aunt before committing suicide.[216]"
July 18,Bibb County,Alabama,5,0,5,A man killed his wife and four children north of West Blocton.[217]
July 18,Washington (10),District of Columbia,2,2,4,"Three suspects opened fire with rifles in an intersection in the Shipley Terrace neighborhood of southeast DC, killing two men and injuring two others, including a two-year-old girl.[218]"
July 18,Los Angeles (3),California,0,4,4,"Two suspects opened fire near a taco stand in the Westlake neighborhood, injuring one intended target and three others.[219]"
July 15,Orange (2),Texas,0,4,4,Four people were injured in a shooting on the city's east side.[220]
July 15,Minneapolis (3),Minnesota,1,5,6,One person was killed and five other people were injured in a shooting at an encampment in the Ventura Village neighborhood of Phillips on the city's south side. One man was arrested on obstruction charges and unrelated warrants.[221]
July 14,Goose Creek,South Carolina,1,3[n 1],4,"A male teenager opened fire on three women, including two other teenagers, as they attempted to enter a vehicle at an apartment complex. After killing one of the teenagers, the shooter then shot himself.[222]"
July 14,Indianapolis (6),Indiana,0,5,5,"Five people, including a boy, were injured in a shooting at a basketball court in the Carson Heights neighborhood on the city's south side.[223]"
July 14,Holly Springs,Mississippi,4[n 1],0,4,Officers responding to a home found three women shot to death in a car and a man dead on the driveway. Investigators later determined it was a murder-suicide.[224]
July 14,Chicago (18),Illinois,0,4,4,Four people were wounded when someone fired multiple shots into the group during a celebration in the Jeffery Manor neighborhood of the city's south side.[225]
July 13,New Haven (1),Connecticut,0,4,4,Four people were shot in the Newhallville neighborhood on the city's north side.[226]
July 13,Birmingham (3),Alabama,4,10,14,A drive-by shooting in the city's north side killed four people and injured ten others at a birthday party held by a social club.[227]
July 13,Meridian,Pennsylvania,2[n 1],3,5,"Attempted assassination of Donald Trump in Pennsylvania: A man opened fire on former President Donald Trump during a campaign rally being held at the Butler Farm Show fairground from atop a nearby roof, killing an audience member, grazing Trump on the ear, and critically injuring two other audience members.[228] The man was then killed by a Secret Service sniper.[229] A Butler Township officer who attempted to climb onto the roof to confront the shooter severely injured his ankle when he fell off the roof when the man pointed his rifle at him just before opening fire on the rally.[230]"
July 12,Louisville (6),Kentucky,0,5,5,Three women and two men were shot in the Russell neighborhood.[231]
July 12,Wichita (2),Kansas,1,4,5,"Four people were found shot, one fatally, in the city's southwest side. One of the victims critically wounded in the same shooting was also found in the South Seneca neighborhood.[232]"
July 12,Chicago (17),Illinois,0,5,5,A drive-by shooting in the North Lawndale neighborhood on the city's west side left five people wounded.[233]
July 11,Wichita (1),Kansas,0,4,4,"Two males opened fire on a group of teenagers, wounding all four, in the Murdock neighborhood.[234]"
July 10,Alameda,California,5,0,5,"A man fatally shot his wife, her parents, and two of his sons at their home before being arrested.[235]"
July 10,Boston (1),Massachusetts,0,5,5,"Five people, including an 11-year-old, were shot while celebrating at a gathering in the Dorchester neighborhood.[236]"
July 9,Charlotte (4),North Carolina,1,3,4,A drug deal gone wrong resulted in a shooting that killed one and injured three in the Westover Hills neighborhood in the city's west side.[237]
July 8,Fort Lauderdale,Florida,2,3,5,"Two people were killed and three others, including a two-year-old, were injured in a drive-by shooting.[238]"
July 8,Washington (9),District of Columbia,0,4,4,Four people were injured near the Navy Yard neighborhood of southeast DC.[239]
July 8,New Bedford,Massachusetts,0,6,6,A shooting at a playground left six people injured.[240]
July 7,Washington County,North Carolina,1,3,4,A man was killed and three others were injured when shots were fired at a house party at a home north of Roper.[241]
July 7,Detroit (6),Michigan,2,19[n 2],21,A block party shooting left two dead and nineteen injured in the Mohican Regent neighborhood on the city's northeast side. Teenagers were among the victims.[242]
July 6,Akron (2),Ohio,0,4,4,A toddler and three adults were injured in the Goodyear Heights neighborhood.[243]
July 6,Milwaukee (3),Wisconsin,0,4,4,"Four people, including three teenagers, were shot in the Williamsburg neighborhood.[244]"
July 6,Florence,Kentucky,5[n 1],3,8,2024 Florence shooting: Four people were killed and three others were injured in a shooting at a residence. The shooter fled the scene in a vehicle and was pursued by police before committing suicide and crashing his car into a ditch.[245][246]
July 5,Clarksdale (1),Mississippi,1,3,4,A drive-by shooting left a man dead and three other men injured when they were fired upon while sitting in a car together.[247]
July 5,Poughkeepsie,New York,0,4,4,Four people were shot overnight along the city's main street.[248]
July 5,Pontiac,Michigan,0,5,5,"A fight during a party escalated when someone opened fire into a crowd, striking five teenage boys.[249]"
July 5,Albany (2),Georgia,1,3,4,"A fight in a nightclub was brought out into the parking lot where multiple people retrieved guns and opened fire, killing a man and injuring three others.[250]"
July 5,Tampa (3),Florida,0,4,4,"Four people, including a security guard, were injured after a fight between two suspects escalated into a shooting at an adult entertainment club.[251]"
July 5,Albany,New York,0,6,6,Six teenagers were shot during a large Independence Day party at home.[252]
July 5,Chicago (16),Illinois,1,6,7,"A shootout between two individuals killed one person and wounded six, including a 15-year-old boy in the Austin neighborhood on the city's west side.[253]"
July 5,Chicago (15),Illinois,0,8,8,Eight people were wounded during a shootout between two individuals in the Little Italy neighborhood in the city's west side.[253]
July 4,Ocean Springs,Mississippi,0,7,7,"A man fired a round of birdshot at a neighbor's Independence Day party, injuring seven, including multiple children.[254]"
July 4,Spanish Lake,Missouri,1,5,6,A man was killed and five others were injured.[255]
July 4,St. Louis (4),Missouri,0,7,7,"Seven people, including four teenagers, were wounded in a shooting in Downtown St. Louis.[255][256]"
July 4,Nashville (4),Tennessee,0,4,4,Four people were struck by celebratory gunfire in Downtown Nashville during an Independence Day celebration.[257]
July 4,Fort Worth (2),Texas,3,3[n 2],6,A fight at a car wash in the Far Southwest neighborhood developed into a shooting in which a man fatally shot another man as well as a baby and a toddler and injured two others. During the gunfire the shooter was also injured.[258]
July 4,Philadelphia (9),Pennsylvania,1,8,9,A man was killed and eight others were injured in a drive-by shooting in the city's southwest side.[259]
July 4,Indianapolis (5),Indiana,1,3[n 2],4,"A dispute over fireworks led to a man opening fire on a group in the Marian - Cold Springs, killing a woman, before he was fired back upon and injured.[260]"
July 4,Chicago (14),Illinois,3,2,5,Two adults and a child were killed and two other children were wounded in the Greater Grand Crossing neighborhood on the city's south side after a personal dispute escalated.[261]
July 2,Knoxville,Tennessee,3[n 2],1,4,"Two men opened fire outside a bar in northwest Knoxville, killing two, including a security guard, and wounding another. One of the shooters later fatally shot himself on July 11 in a Jacksonville, Florida hotel room after U.S. Marshals closed in on him.[262]"
July 1,Philadelphia (8),Pennsylvania,0,5[n 2],5,Five people were wounded during a shootout at a Chinese restaurant in the Grays Ferry neighborhood in the city's south side.[263][264]
July 1,Charleston,Missouri,0,6,6,Six people were shot in a civic center parking lot.[265]
July 1,Cincinnati (2),Ohio,3,1,4,"Four people were shot, three fatally, in a shooting in Corryville near the campus of the University of Cincinnati.[266][267]"
June 29,Screven County,Georgia,0,6,6,Six people were wounded during a block party when multiple shooters opened fire at a fireworks festival in the Lawton Place neighborhood near Sylvania.[268][269]
June 29,Coweta County,Georgia,4[n 1],0,4,A man shot and killed three people at a home before killing himself.[270]
June 28,Crete,Nebraska,1[n 1],7,8,"A man opened fire at a home across from his, wounding seven, including four children. After police made entry into the shooter's house they found him dead of a self-inflicted gunshot wound.[271] The victims were Guatemalan immigrants, and authorities are investigating if there was a racial motive.[272]"
June 28,Niagara Falls,New York,0,4,4,"A fight escalated into a shooting that wounded four, including a teenage boy, shortly after midnight.[273]"
June 28,Corpus Christi (1),Texas,2,3,5,Two teenagers were killed and three others were injured in a midnight shooting in the city's west side.[274]
June 26,Lancaster (1),California,2,5,7,Two men were killed and five others were injured when a group of men outside an apartment complex were fired upon.[275]
June 26,Milwaukee (2),Wisconsin,0,4,4,"Four people were injured in a targeted shooting at a BP gas station, including two children, in the White Manor neighborhood.[276]"
June 24,North Las Vegas (2),Nevada,6[n 1],1,7,Five people were killed and a teenage girl was critically injured at an apartment complex. The suspect later committed suicide  after being located by officers.[277]
June 24,Manatee County & Memphis,Florida,4[n 1],0,4,"A man drove to a Motel 6 east of Bradenton where he fatally shot his mother. He then drove to a home in Memphis where he killed one of his cousins. Finally, he drove to a home south of West Bradenton where he killed his final victim, the friend of one of his ex-girlfriends. During the early morning of the following day the shooter was killed in a shoot-out with Hamilton County Sheriff's Office deputies at a service station off Interstate 75.[278][279]"
June 24,York,Pennsylvania,0,4,4,Four teenage girls were shot during the early evening.[280]
June 24,Dayton (2),Ohio,1[n 1],4,5,"Four people, including an 11-year-old boy, were injured in a domestic related shooting in the Greenwich Village neighborhood. The suspect was also injured and drove himself to a hospital where he later died.[281]"
June 24,Dayton (1),Ohio,2,5,7,A woman was killed and six others were injured in a drive-by shooting in the MacFarlane neighborhood. One of the victims who was a teenager later died.[282]
June 23,Trenton,New Jersey,0,4,4,Four people were shot in the Greenwood & Hamilton neighborhood during the early morning.[283]
June 23,Vallejo,California,0,4,4,Four people were shot during the early morning hours.[284]
June 23,Winston-Salem,North Carolina,1,4[n 1],5,"An 18-year-old man was killed and four others were injured, including the man who killed him, in an early morning shooting.[285]"
June 23,Montgomery (3),Alabama,0,9,9,"A shooting at a party wounded nine, including three juveniles, in the Boylston neighborhood. Four others were injured while fleeing the gunfire either in vehicular accidents or by broken glass.[286]"
June 23,St. Louis (3),Missouri,1,5,6,"A fight in Downtown St. Louis erupted in gunfire, killing a man and injuring five others. A police officer was assaulted while responding to the scene.[287]"
June 23,Rochester (1),New York,0,6,6,A fight at a park in Downtown Rochester escalated into a shooting that wounded six. While securing the scene a police officer was assaulted and suffered a knee injury by a man who was then arrested.[288]
June 23,Tampa (2),Florida,1,3,4,Jacksonville-based rapper Julio Foolio was killed and three others were injured in an 'ambush' shooting at the Holiday Inn parking lot near the University of South Florida campus.[289][290]
June 23,Columbus (4),Ohio,0,10,10,Ten people were shot in the Short North Arts District near Downtown Columbus.[291]
June 22,Henrico County (2),Virginia,0,6,6,Six adults were shot north of Glen Allen off of State Route 626 shortly before midnight.[292]
June 22,Canton,Mississippi,1,5,6,A 19-year-old man fatally shot another man and injured five others at a popular city hangout spot.[293]
June 22,Louisville (5),Kentucky,1,7,8,"Eight people were shot at a nightclub, with one man being killed, in the Russell neighborhood shortly after midnight.[294]"
June 21,Meridian,Mississippi,1,3,4,A man was killed and three others were injured in a shooting during the late afternoon.[295]
June 21,Washington (8),District of Columbia,0,4,4,Three men and a woman were shot in the Congress Heights neighborhood of southeast DC shortly before midnight.[296]
June 21,Fordyce,Arkansas,4,10[n 1],14,"2024 Fordyce shooting: A shooting at a local grocery store left four people dead and nine others injured, including two police officers. The shooter was shot by responding police and arrested.[297][298]"
June 19,Oakland (1),California,0,15,15,"During a Juneteenth celebration near Lake Merritt, an illegal sideshow began, and a fight escalated, leading to fifteen people being struck by gunfire. One woman was also arrested for assaulting a police officer.[299]"
June 19,Philadelphia (7),Pennsylvania,0,7,7,"Three shooters opened fire at a crowd in the Allegheny West neighborhood on the city's north side, wounding seven, including a teenage girl. Police believe the victims were targeted.[300]"
June 18,Richmond,California,2,2,4,"Two people were killed, including a pregnant woman, and two others were injured in a shooting in the Iron Triangle neighborhood. Two of the shooting victims are juveniles.[301]"
June 17,Macon,Georgia,1,3,4,A woman was killed and three men were wounded in a shooting shortly before midnight.[302]
June 17,Chicago (13),Illinois,0,7,7,A shootout between two people in the West Englewood community on the city's southwest side left seven people injured in the crossfire.[303]
June 17,Chicago (12),Illinois,0,5,5,"A person fired into a crowd of people in the Humboldt Park community on the city's west side, wounding five, including three teenagers. A woman also suffered a broken ankle while fleeing the gunfire.[303]"
June 16,South Bend (1),Indiana,0,4,4,A shooting at a Marathon gas station left four people injured.[304]
June 16,Methuen,Massachusetts,0,7,7,"Seven people were shot during a gathering in a commercial area, including several teenagers, with one other sustaining a head injury while fleeing.[305]"
June 16,Pine Bluff,Arkansas,1,3,4,"Four people were shot, one fatally, in the parking lot of a lakeside park.[306]"
June 15,Detroit (5),Michigan,1,4,5,"Four females, including at least one teenager, and a man were shot in the Osborn area on the city's northeast side. One adult female was killed.[307]"
June 15,Northdale,Florida,3[n 1],1,4,A 19-year-old man killed his parents and injured one officer in a shootout. He was then shot and killed by officers.[308]
June 15,Round Rock,Texas,2,14,16,"Two people were killed and at least fourteen people were injured in a shooting at Old Settlers Park during a Juneteenth festival, which featured performances from artists such as Sean Ardoin and Paul Wall, when two groups opened fire on each other.[309][310]"
